label,id,name,username,bio,location,url,join_date,join_time,tweets,following,followers,likes,media,private,verified,profile_image_url,background_image,color_number,face_detection,follower/following_ratio,b_key_count,i_key_countindividual,2418294356,Ravi Gajula,RavikGajula,President & CEO at AGM Industries Inc,,https://www.linkedin.com/in/ravi-gajula-888a9521,3/29/14,19:13:00,0,192,38,1,0,0,0,https://pbs.twimg.com/profile_images/721048313454333952/fJOci8K8_400x400.jpg,,45245,0,0.197916667,0,0individual,3031490853,Charlotte Petris,charpetris,Founder & CEO @Timelio. Obsessed with ~doing it different~ in the world of finance.,"Melbourne, Australia",http://timelio.com.au,2/11/15,15:04:00,815,413,719,484,82,0,0,https://pbs.twimg.com/profile_images/565649457882992640/SCpVIQZb_400x400.jpeg,https://pbs.twimg.com/profile_banners/3031490853/1423701276/1500x500,20604,1,1.740920097,1,0individual,366255848,Steve Hodgdon,SteveHodgdon,"CEO of Modern Asset Management, 30 year collection veteran",,http://www.modernassetmanagement.com,9/1/11,14:14:00,1147,307,206,290,579,0,0,https://pbs.twimg.com/profile_images/1566925877/162fc46_400x400.jpg,,44848,1,0.671009772,0,0individual,7.00E+17,Swati Patel,SwatPat1010,Product Marketing Manager @Linkedin | @Wharton MBA | Founder @CCWharton | @InSITEFellows | Former VP @JPMorgan | Economics @NYU,,,2/17/16,16:44:00,111,371,92,104,1,0,0,https://pbs.twimg.com/profile_images/891862036686061568/DjiFwCd0_400x400.jpg,https://pbs.twimg.com/profile_banners/700118704621821954/1490820074/1500x500,22617,1,0.247978437,0,0individual,18910068,Kenneth Holley,kennethholley,It's all about who you know and who you trust ___Î¢_—_’öÎåÎŒÎ¢ There's never any rest for the terminally ambitious ___Î¢_—_’öÎåÎŒÎ¢ CEO @silentquadrant ___Î¢_—_’öÎåÎŒÎ¢ Angel investor ___Î¢_—_’öÎåÎŒÎ¢ Former @USNavy,"Washington, DC  ___Î¢_—_’öÎåÎŒÎ¢  Austin",http://silentquadrant.com,1/12/09,10:41:00,33693,13006,56301,17832,286,0,0,https://pbs.twimg.com/profile_images/840923965635854336/MNxnepsk_400x400.jpg,https://pbs.twimg.com/profile_banners/18910068/1498315990/1500x500,44436,1,4.328848224,0,1individual,209992050,Somnath Lahiri,somnathl,@Product @Tech @Management Consultant @Engineer @Founder,,,10/30/10,2:47:00,20,102,40,4,0,0,0,https://pbs.twimg.com/profile_images/696388589492576256/p3kZhzU0_400x400.jpg,,38129,1,0.392156863,0,0business,1.13E+18,LENDVER,LendverLLC,BORROW CONFIDENTLY. We___Î¢_—_’öÎå_—_’•Î¢ve done the research for you. No forms to fill out. No personal information required. Just free reviews.,,https://www.lendver.com/,5/29/19,7:32:00,2,22,2,0,1,0,0,https://pbs.twimg.com/profile_images/1133758598549524483/Yf4SQ5U5_400x400.png,https://pbs.twimg.com/profile_banners/1133742841899999233/1559141341/1500x500,510,0,0.090909091,0,0business,8.89E+17,Lendtek,Lendtek,Business Loans ___________èÎŒ’™ÎŒÎç See What Lenders You Match With! Download our App in the Apple store or Google play today! Link below ___________è_—_’Ü’__—_’ÜÎç,,https://www.lendtek.com/lendtekapp,7/23/17,17:46:00,26,373,50,24,2,0,0,https://pbs.twimg.com/profile_images/948676616145678336/wrs5yQsk_400x400.jpg,https://pbs.twimg.com/profile_banners/889285629279965184/1547170569/1500x500,4565,0,0.134048257,0,0business,1.01E+18,CitizenCreditScore,citizen_score,Citizen Credit Score provides value to individual impact while encouraging and empowering citizens to change their world | #CitizenCreditScore #SDGs,,http://www.CitizenCreditScore.com,6/11/18,10:43:00,4,925,38,217,3,0,0,https://pbs.twimg.com/profile_images/1128464727120732161/SchTsk7Y_400x400.jpg,https://pbs.twimg.com/profile_banners/1006230454062723073/1558501792/1500x500,254,0,0.041081081,1,0business,1.10E+18,Hirezones,Hirezones1,,,,2/21/19,22:13:00,0,3487,105,2,0,0,0,https://pbs.twimg.com/profile_images/1098837786583429120/zm5IAHFI_400x400.png,,1356,0,0.030111844,0,0business,7.42E+17,Bitexpress,BitexpressBTMs,User friendly Bitcoin ATMs with competitive fees and great locations!,,http://www.bitexpress.com,6/13/16,15:39:00,134,1238,434,3,89,0,0,https://pbs.twimg.com/profile_images/800440770826211328/Iv1FlNLj_400x400.jpg,https://pbs.twimg.com/profile_banners/742486569676836864/1479675932/1500x500,3628,0,0.350565428,0,0business,8.10E+17,Thistle-at-Law,WallyStummy,Free trade theory depends on the assumption that jobs lost to offshoring will be replaced by better ones. True in 1900 for farm-to-factory but false today.,Appalachian ___’öÎŒ_—____________èÎŒ’å___’_ & NYC-at-law,,12/16/16,14:26:00,41375,4667,850,47143,89,0,0,https://pbs.twimg.com/profile_images/931610127450411010/Az5M0T6n_400x400.jpg,,58670,0,0.182129848,0,0business,59828496,Cardlytics,cardlytics,Cardlytics (NASDAQ: CDLX) uses purchase intelligence to make marketing more relevant and measurable.,,http://www.cardlytics.com,7/24/09,9:46:00,1650,871,2435,792,228,0,0,https://pbs.twimg.com/profile_images/1045719128978350080/1kgcvCtY_400x400.jpg,https://pbs.twimg.com/profile_banners/59828496/1538066827/1500x500,2189,0,2.795637199,0,1business,2895965731,SnapCap,Snap_Cap,Helping business owners get the funding they need to succeed. Call us at 1-800-843-0130,"Charleston, SC",http://www.SnapCap.com,11/10/14,12:13:00,1507,289,785,181,85,0,0,https://pbs.twimg.com/profile_images/847861789106819072/CIYMeXpw_400x400.jpg,https://pbs.twimg.com/profile_banners/2895965731/1476297111/1500x500,3762,0,2.716262976,1,0business,1.12E+18,Froogal - US,froogal_usa,"Ditch banks, get Froogal.  The future of savings: highest deposit rates, social savings, FDIC-Insured. Built by and for financial freedom chasers.","Florida, USA",http://froogal.us,5/4/19,8:21:00,54,2719,270,83,0,0,0,https://pbs.twimg.com/profile_images/1128082095375564802/0oVLamz9_400x400.png,https://pbs.twimg.com/profile_banners/1124695618138640386/1558958633/1500x500,6,999,0.099301214,1,1business,9.25E+17,FullStack,FullStackPEO,Scale your business faster. Let us focus on your people.,"Indianapolis, IN",http://www.fullstackpeo.com,10/29/17,9:24:00,268,898,139,101,75,0,0,https://pbs.twimg.com/profile_images/924674592811208704/_yRgkprb_400x400.jpg,https://pbs.twimg.com/profile_banners/924673374172966912/1521556160/1500x500,2726,0,0.154788419,0,0business,80665542,Registria,registria,We provide solutions and services purpose built to activate every aspect of the customer journey. Trusted by more than 300 of the world's leading brands.,Mountain View | Denver,http://www.registria.com,10/7/09,12:57:00,1331,1142,1379,484,334,0,0,https://pbs.twimg.com/profile_images/1039579646830948352/AEmW1BM5_400x400.jpg,https://pbs.twimg.com/profile_banners/80665542/1536690136/1500x500,3725,0,1.207530648,4,0business,8.54E+17,72 Services LLC,72Services,#Enterprise #software renovators serving the U.S. and Switzerland. We #modernize #legacysoftware and #applications so they can find new life in a modern market.,,https://72.services/,4/17/17,6:31:00,468,396,73,42,149,0,0,https://pbs.twimg.com/profile_images/983718409757122560/t4M8Ba4X_400x400.jpg,https://pbs.twimg.com/profile_banners/853964121146044418/1501725873/1500x500,33542,1,0.184343434,0,0business,1924937533,CardLinx Association,CardlinxAssoc,"The CardLinx Association increases interoperability, eliminates friction and promotes the growth of the card-linking industry.",,http://www.cardlinx.org,10/1/13,16:02:00,1089,1247,815,38,542,0,0,https://pbs.twimg.com/profile_images/1113948610549374976/EQhaxE0B_400x400.png,https://pbs.twimg.com/profile_banners/1924937533/1554421861/1500x500,1354,0,0.653568565,0,0business,8.92E+17,FATORSYN!,fatorsyn,Plataforma de #mentoria e #ead profissional Acesse http://www.fatorsyn.com.br___’öÎŒ_—_ - http://www.ead.fatorsyn.com.br___’öÎŒ_—_ #startup #ensino #mentoring Curitiba-PR-Brasil,,https://fatorsyn.com.br,8/1/17,6:17:00,7409,4220,948,7798,185,0,0,https://pbs.twimg.com/profile_images/1029543070130491393/fQAeQXFN_400x400.jpg,https://pbs.twimg.com/profile_banners/892373684555579392/1550523815/1500x500,8804,0,0.22464455,0,0business,1.12E+18,New Tech Database,NewTechBase,Discover new technologies from innovative companies and the people behind them.,,http://newtechbase.com,4/16/19,19:22:00,100,2258,215,1,0,0,0,https://pbs.twimg.com/profile_images/1132860365983879168/LILA98WT_400x400.png,https://pbs.twimg.com/profile_banners/1118338987511484417/1558923795/1500x500,14010,0,0.095217006,0,0business,2394875382,Juliet Foxtrot Ventures,JFVentures,"Juliet Foxtrot Ventures is a next generation investment firm investing in all stages of blockchain development, from incubation to early-stage and growth.","San Francisco, CA",https://angel.co/company/juliet-foxtrot-ventures,3/17/14,11:19:00,579,163,119,33,10,0,0,https://pbs.twimg.com/profile_images/1130820164977647616/YheY7smr_400x400.jpg,https://pbs.twimg.com/profile_banners/2394875382/1558395319/1500x500,7934,0,0.73006135,0,0business,1.13E+18,Ryan Hurley,RyanHur06436445,Experts in providing flexible working capital solutions to successful small business owners.,,,5/9/19,16:14:00,0,7,0,0,0,0,0,https://pbs.twimg.com/profile_images/1126626748257447936/YhwnAf1t_400x400.png,,86,0,0,3,0business,3977505558,Quandary Consulting Group ___________è_—_’Ü’ÂÎŒÎé,quandarycg,___________è_—_’Ü’‚ÎŒÎµ Let___Î¢_—_’öÎå_—_’•Î¢s grow together. BUILD___Î¢___’__—_’ÜÎ¢CONNECT___Î¢___’__—_’ÜÎ¢MARKET ___________è_—_’Ü’____Ô©Business ___________è_—_’Ü’____’_Tech ___________è_—_’Ü’‚ÎŒÎçInsights ___________èÎŒÎ_ÎŒ’_Quick Base & Workato Partner ___________è_—_’Ü’_ÎŒ’_Denver ___________è_—_’Ü’_ÎŒ’_New York ___________è_—_’Ü’_ÎŒ’_Chicago,"Denver, CO",http://www.quandarycg.com/,10/22/15,0:02:00,477,1796,462,331,72,0,0,https://pbs.twimg.com/profile_images/1062099979240501248/JgEYh48y_400x400.jpg,https://pbs.twimg.com/profile_banners/3977505558/1542043769/1500x500,2454,0,0.257238307,0,0business,1.11E+18,Fintech Events USA,FintecheventUSA,#Fintech #Blockchain #DigitalFinance #payments #Events and #Conferences in USA,,http://fintechnews.ch,3/13/19,18:46:00,0,64,19,0,0,0,0,https://pbs.twimg.com/profile_images/1106073446914486273/2vqCEHMc_400x400.png,https://pbs.twimg.com/profile_banners/1106008669341118464/1552543808/1500x500,7156,0,0.296875,0,0business,1852007431,Konf___’_ÎŒ___o,konfiomx,Pr___’_ÎŒÎ©stamos en l___’_ÎŒ___nea para peque___’_ÎŒÎ±os negocios que quieren crecer y convertirse en empresas de alto impacto.,M___’_ÎŒÎ©xico DF,http://konfio.mx,9/10/13,9:50:00,2221,434,1657,410,666,0,0,https://pbs.twimg.com/profile_images/1024727576407760896/-of9bKMh_400x400.jpg,https://pbs.twimg.com/profile_banners/1852007431/1555955493/1500x500,5558,0,3.81797235,0,0business,8.43E+17,TechTarget FR,TechTargetFR,"@TechTarget se situe au point de rencontre online des acheteurs IT en entreprise, des experts en contenu ___’_ÎŒ_—_ valeur technologique et des fournisseurs IT mondiaux.",,http://www.techtarget.fr,3/17/17,13:52:00,1151,1242,358,223,217,0,0,https://pbs.twimg.com/profile_images/843832255730585600/TmkwucpN_400x400.jpg,https://pbs.twimg.com/profile_banners/842841144581111808/1490117632/1500x500,6802,0,0.288244767,0,0business,1.12E+18,FundingSMB.com,FundingSMB,,,,5/1/19,20:43:00,0,3,0,0,0,0,0,https://abs.twimg.com/sticky/default_profile_images/default_profile_400x400.png,,184,0,0,0,0business,1.08E+18,Bridge Bay Capital,BridgeBayCap,,"New York, NY",http://www.bridgebaycapital.com,1/10/19,5:55:00,1,24,1,1,0,0,0,https://pbs.twimg.com/profile_images/1120754142350331905/ylUNHHLf_400x400.png,,1461,0,0.041666667,0,0business,60417173,Team MISSION POSSIBLE,MissionPOSSlBLE,Team for Kyle Sawyer (@heyyyykp) @LLSusa nominated Man of the Year 2019 fundraiser page | #MWOY2019 Join our Team below ___Î¢_—_’Ü_—_ÎŒ’… 150k goal,"Portland, OR",https://pages.mwoy.org/oswim/oswim19/ksawyer,7/26/09,15:49:00,281,4994,4353,10120,86,0,0,https://pbs.twimg.com/profile_images/1096308966936592384/pLZHZmlE_400x400.jpg,https://pbs.twimg.com/profile_banners/60417173/1550216522/1500x500,4393,0,0.871645975,0,0business,8.58E+17,DOMM LIFE,DOMM_LIFE,Our Mission To break down the barriers for patients to quickly and efficiently access their holistic medical needs all in one cannabis friendly ecosystem,"Phoenix, AZ",https://domm.life/,4/27/17,4:13:00,465,553,366,1231,77,0,0,https://pbs.twimg.com/profile_images/996468458920394752/_zlvrFdQ_400x400.jpg,https://pbs.twimg.com/profile_banners/857553214601797632/1531258065/1500x500,11217,0,0.661844485,0,0business,7.84E+17,7 Chord,7chordbd,7 Chord is a #fintech #startup that uses #machinelearning and #AI to empower #fixedincome traders with predictive pricing and trading signals.,,http://www.7-chord.com,10/5/16,21:17:00,85,981,213,155,22,0,0,https://pbs.twimg.com/profile_images/960383360915800064/Cl1Wz5ei_400x400.jpg,https://pbs.twimg.com/profile_banners/783883913546625024/1517808069/1500x500,4477,0,0.217125382,0,1business,9.83E+17,RetireFly.com,retirefly,"http://RetireFly.com___’öÎŒ_—_ is the Premier RETIREMENT RESOURCE DIRECTORY. We are your one-stop destination for Finance, Real Estate, Travel, and Retirement Related Services.",,http://www.retirefly.com,4/9/18,16:22:00,231,3849,1269,1404,31,0,0,https://pbs.twimg.com/profile_images/984070724548608001/fbrJV_n1_400x400.jpg,https://pbs.twimg.com/profile_banners/983485377263669248/1523456152/1500x500,6591,0,0.329696025,0,0business,1.11E+18,The Mad Investor,madinvestorblog,Just a dude who likes trying out various investment platforms and alternative investment options. Follow me for investment advice and real reviews with examples,,https://themadinvestor.com/,3/11/19,19:27:00,22,28,8,28,3,0,0,https://pbs.twimg.com/profile_images/1111670323764756481/i0zJZH_v_400x400.png,https://pbs.twimg.com/profile_banners/1105294301364400128/1554934528/1500x500,5101,0,0.285714286,1,0business,38522465,Proof,get_proof,Proof is an independent communications & marketing agency with curiosity at its core. We build strong brands and reputations because we ASK BETTER QUESTIONS.,North America,http://www.getproof.com,5/7/09,14:33:00,5049,1449,3670,1494,742,0,0,https://pbs.twimg.com/profile_images/970887739666247681/_YfyYM1A_400x400.jpg,https://pbs.twimg.com/profile_banners/38522465/1528309484/1500x500,2743,0,2.532781228,0,1business,1.12E+18,LEADS NATION PRO,LeadsNation,Leads nation pro expertise in lead generation in Merchant cash advance and credit repair leads. We started our journey as an outbound & Inbound call center.,,,4/21/19,17:22:00,9,295,38,2,1,0,0,https://pbs.twimg.com/profile_images/1120122660061466624/vPo4-SNP_400x400.png,,1325,0,0.128813559,0,0business,1.04E+18,"Focus, Relax, Revive",market_cbd,CBD 20% OFF     http://bit.ly/2NAsy4J___’öÎŒ_—_  ---- Promo:20OFF  FREE SHIPPING when you spend $98 or more!  Find it here http://bit.ly/2NAsy4J___’öÎŒ_—_,"NY, USA",https://bit.ly/2NAsy4J,9/24/18,18:05:00,17,1284,318,571,0,0,0,https://pbs.twimg.com/profile_images/1044405955050524672/sEp43ek__400x400.jpg,https://pbs.twimg.com/profile_banners/1044392322006495232/1537840757/1500x500,23540,0,0.247663551,0,0business,28634721,Eric Alston,icmplay,The goal is to assist in the development and exposure of deserving athletes by providing honest and accurate journalistic assessments. Therefore ICMPLAY.,South Florida,http://icmplay.com,4/3/09,12:37:00,4128,3280,2267,777,113,0,0,https://pbs.twimg.com/profile_images/1008894661598072833/178NMcyr_400x400.jpg,https://pbs.twimg.com/profile_banners/28634721/1516892051/1500x500,3859,0,0.691158537,0,0business,7.78E+17,TheFutureEconomy.ca,FuturEconomy,"Interviews with top ___________è_—_’ÜÎçÎŒÎÂ___________è_—_’ÜÎçÎŒÎ_ leaders from government, industry & academia on key topics of the #CdnEcon & #CdnPoli. Join us & share the vision!",Canada,http://www.TheFutureEconomy.ca,9/19/16,9:09:00,8316,3097,9731,14509,1061,0,0,https://pbs.twimg.com/profile_images/793638465317535744/-JxyrYV8_400x400.jpg,https://pbs.twimg.com/profile_banners/777902325771988992/1557413063/1500x500,15382,0,3.142072974,0,0business,262025527,onlinecheck,onlinecheck,"America___Î¢_—_’öÎå_—_’•Î¢s small business funding experts since 1996. Approval for Cash Advance, Business Loan and small business loans: Funding from $5000 to $5000,000","Essex, Connecticut",https://www.onlinecheck.com,3/6/11,21:28:00,4159,4977,1021,37,800,0,0,https://pbs.twimg.com/profile_images/1081514504754745344/CU_puPXi_400x400.jpg,https://pbs.twimg.com/profile_banners/262025527/1546688373/1500x500,5801,0,0.205143661,3,0business,1.10E+18,Leveled UP,leveledupco,Iowa Startup | Small Business Services | Shooters Shoot,,http://leveledup.co,2/16/19,21:22:00,99,402,27,46,27,0,0,https://pbs.twimg.com/profile_images/1106618333636542469/eoXCk4dr_400x400.png,https://pbs.twimg.com/profile_banners/1097003251487178752/1555128823/1500x500,9931,0,0.067164179,0,0business,1.02E+18,Whipsaw Thoroughbred Racing Partnership Group,WhipsawGroup,Racing Syndicate offering affordable racing partneships for every budget. With all the perks of the rich. Top racing trainers. And yearling guru Dominic Brennan,Burleson tx,http://www.whipsawttb.com,7/28/18,13:08:00,382,557,57,198,1,0,0,https://pbs.twimg.com/profile_images/1023300462026448896/CGChkuvT_400x400.jpg,https://pbs.twimg.com/profile_banners/1023299136291065856/1532808823/1500x500,19849,0,0.102333932,0,0business,1.02E+18,AngleNiche.com,IzabeyahS,Life and Spiritual Center,,https://www.angleniche.com,7/11/18,14:31:00,161,1536,82,139,15,0,0,https://pbs.twimg.com/profile_images/1116744093818859521/1gOODpd9_400x400.png,https://pbs.twimg.com/profile_banners/1017159531149881344/1555087630/1500x500,43312,0,0.053385417,0,0business,9.13E+17,Orrick Tech,OrrickTech,Innovative legal partners. http://aad.orrick.com___’öÎŒ_—_,,https://www.orrick.com/Technology,9/28/17,12:09:00,391,619,201,346,106,0,0,https://pbs.twimg.com/profile_images/913517464570474498/zBmR0z8x_400x400.jpg,https://pbs.twimg.com/profile_banners/913480759058604032/1540428682/1500x500,3638,0,0.324717286,0,0business,2614140402,Mission Montessori Academy,mmacademyaz,"A Charter Academy in Scottsdale, Arizona","Scottsdale, AZ",http://www.missionmontessori.com,7/9/14,13:20:00,1464,2662,382,1147,213,0,0,https://pbs.twimg.com/profile_images/1103827005190004736/miU7DJ78_400x400.png,https://pbs.twimg.com/profile_banners/2614140402/1552007827/1500x500,6769,0,0.143501127,0,0business,2432007996,FinTech,FinTechStartups,The best of #Fintech and #Blockchain #insurtech #crowdfunfing #assurtech #crowdlending #bitcoin #AssetManagement Biggest French Community,,http://www.meetup.com/fr/FinTech-Startups/,4/7/14,6:01:00,1077,3474,4075,2472,194,0,0,https://pbs.twimg.com/profile_images/653915250891333632/Ll5eCXC0_400x400.jpg,https://pbs.twimg.com/profile_banners/2432007996/1433759632/1500x500,15840,0,1.172999424,1,0business,1.11E+18,CMU AI,AIatCMU,"Uniting students, faculty & staff from all areas, to bring you cutting edge research on the fields and sub-fields of AI.",,https://ai.cs.cmu.edu,3/25/19,10:37:00,27,2976,235,8,7,0,0,https://pbs.twimg.com/profile_images/1111680201103208453/Zn2EMXer_400x400.png,https://pbs.twimg.com/profile_banners/1110234138601312256/1553539962/1500x500,8330,0,0.078965054,0,0business,1.07E+18,Credit Nervana,creditnervana,Welcome to Creditnervana. We write the whole truth about modern finance in all forms.,,https://creditnervana.com,12/14/18,10:47:00,38,2077,344,40,35,0,0,https://pbs.twimg.com/profile_images/1073651139399303168/Oykn91QZ_400x400.jpg,https://pbs.twimg.com/profile_banners/1073650807487295488/1544813835/1500x500,4382,0,0.165623495,1,0business,1.11E+18,Transfast Corporate,TransfastCorp,Transfast is a global cross-border payments network provider that covers over 95% of bank accounts worldwide.,,https://www.transfast.com,3/27/19,14:03:00,3,237,31,2,1,0,0,https://pbs.twimg.com/profile_images/1111013388170248193/-FPNKDE-_400x400.png,https://pbs.twimg.com/profile_banners/1111010950621077504/1553873838/1500x500,5358,0,0.130801688,1,0business,23500215,TDC,trudydarwin,Our integrated #press campaigns win #awards and create global #ThoughtLeaders! #PR #TechPR #Thoughtleadership #Scaleup #Startups #VC #AI #FinTech #AgTech,C | STL,http://www.trudydarwin.com,3/9/09,13:59:00,4521,10990,11723,6669,548,0,0,https://pbs.twimg.com/profile_images/891844584367570944/npwZw2cf_400x400.jpg,https://pbs.twimg.com/profile_banners/23500215/1501467145/1500x500,7422,0,1.066696997,0,0business,598812074,LeanData,LeanData,"LeanData is the leader in enterprise #RevenueOps solutions, helping businesses accelerate revenue and growth through a holistic, unified go-to-market approach.","Sunnyvale, CA",http://www.leandatainc.com,6/3/12,18:17:00,3596,2650,2126,1098,1728,0,0,https://pbs.twimg.com/profile_images/1018870187511017472/efcmx4r-_400x400.jpg,,2961,0,0.802264151,3,0business,1.11E+18,RJRD Associates & Consultants L.L.C.,rjrdac,A SDVOSB that strives to understand consumer difficulties and provide unique solutions to support business & federal agency optimization. #VetBiz #SmallBiz,"DC Metro area/Mebane, NC",http://www.rjrdac.com,4/1/19,13:26:00,15,385,92,66,1,0,0,https://pbs.twimg.com/profile_images/1112827869808521222/_AnG0ZUx_400x400.jpg,https://pbs.twimg.com/profile_banners/1112813473342341120/1554152583/1500x500,6607,0,0.238961039,2,0business,208643006,Marqeta,Marqeta,Marqeta's payment card platform is accelerating possibilities for the world___Î¢_—_’öÎå_—_’•Î¢s innovators. Featuring current news from around the payments world.,The San Francisco Bay Area,http://www.marqeta.com,10/27/10,10:07:00,12732,9227,10790,3809,504,0,1,https://pbs.twimg.com/profile_images/1085972287889727489/-ocL3jVQ_400x400.jpg,https://pbs.twimg.com/profile_banners/208643006/1540482709/1500x500,2726,0,1.169394169,1,0business,1.05E+18,Servicing Solutions,ServicingSol,"Primary and backup loan servicing that will protect the value of your brand, portfolio, and investment. #ServicingSolutions","Irving, TX",http://www.servicingsolutions.com,10/1/18,10:58:00,67,750,128,148,46,0,0,https://pbs.twimg.com/profile_images/1050081576955056128/FEoB9tbJ_400x400.jpg,https://pbs.twimg.com/profile_banners/1046821707514880000/1539193819/1500x500,4817,0,0.170666667,0,0business,1.00E+18,LendLedger,LendLedger,Open network on Blockchain solving trillion-dollar lending gaps. Join us on Telegram for immediate updates ___________è_—_’Ü’__—_’Ü___https://t.me/lendledger___’öÎŒ_—_,"New York, NY",http://lendledger.io,5/25/18,12:42:00,222,257,888,95,125,0,0,https://pbs.twimg.com/profile_images/1002671070283878400/ESkpD6Nn_400x400.jpg,https://pbs.twimg.com/profile_banners/1000099799507419136/1530976125/1500x500,6442,0,3.455252918,1,0business,1.11E+18,LocalPros Marketing,localprosmktg,Full-Service Digital Marketing Agency Helping Small Businesses For Over 10 Years. #WebDesign #SEO #PPC,,https://www.localprosmarketing.com,3/27/19,8:07:00,19,1189,356,168,19,0,0,https://pbs.twimg.com/profile_images/1110940648285310976/OV93A2_t_400x400.png,,2425,0,0.29941127,0,0business,1.10E+18,LeadGenerationWorld,LeadGenerationW,Our Mission is to help you navigate the Lead Generation World. For more info visit http://www.LeadGenerationWorld.com___’öÎŒ_—_,,,3/7/19,22:07:00,16,580,64,155,0,0,0,https://pbs.twimg.com/profile_images/1103900573319876611/ZpEZM3C2_400x400.jpg,https://pbs.twimg.com/profile_banners/1103900031277387783/1552025581/1500x500,8558,0,0.110344828,1,0business,9.23E+17,FlowCare Solutions,flowcare_,"A patent-pending nurse server with other #HealthcareStorage options available!  #HealthcareDesign, #Healthcare, #HealthTech",,https://www.flowcaresolutions.com/,10/23/17,13:26:00,1175,711,106,91,466,0,0,https://pbs.twimg.com/profile_images/1102704875979399169/R5S5gtb1_400x400.png,https://pbs.twimg.com/profile_banners/922559772683067393/1551740318/1500x500,3041,0,0.149085795,0,0business,9.75E+17,Growth Finance Awards,GFawards,The first event showcasing and celebrating the role of the #GrowthFinance community in supporting growing and high-potential #SMEs. Organised by @Intelligentwit,,http://www.growthfinanceawards.com,3/16/18,4:17:00,37,285,109,9,30,0,0,https://pbs.twimg.com/profile_images/1101150146476298240/gn4V5bzL_400x400.png,https://pbs.twimg.com/profile_banners/974605667188248576/1554480581/1500x500,2381,0,0.38245614,0,0business,2446708908,Glocalise,Glocalise_Ltd,"Multilingual, bleeding-edge, performance-based #PPC, SMM, SEO, Influencer & #eCommerce-as-a-Service Agency #DACH #SaaS",,http://www.linkedin.com/company/glocalise-ltd/,4/16/14,0:10:00,102,1120,172,127,22,0,0,https://pbs.twimg.com/profile_images/898255227656318976/qVtMsm1C_400x400.jpg,https://pbs.twimg.com/profile_banners/2446708908/1475273220/1500x500,256,0,0.153571429,0,0business,192503208,Decimal Factor,decimalfactor,Looking for a buisness loan ?,"Canary Wharf, London.",http://www.decimalfactor.co.uk,9/19/10,3:09:00,77,407,155,12,36,0,0,https://pbs.twimg.com/profile_images/793559414217334784/kleaLiab_400x400.jpg,https://pbs.twimg.com/profile_banners/192503208/1551460367/1500x500,8232,0,0.380835381,0,0business,1.10E+18,Atoconn Private Limited,atoconnpvtltd,Partners in Growth & Innovation  #SoftwareDevelopment #AI #Web #Mobile #MachineLearning  info@atoconn.com | support@atoconn.com,,http://www.atoconn.com,2/27/19,17:35:00,3,472,45,10,2,0,0,https://pbs.twimg.com/profile_images/1100932959555616768/9CTCCNxA_400x400.jpg,,3102,0,0.095338983,0,0business,1.11E+18,Voca.ai,voca_ai,,,https://www.voca.ai/,3/14/19,16:07:00,9,22,19,8,1,0,0,https://pbs.twimg.com/profile_images/1106335307711082502/PRIGhw_p_400x400.png,,847,0,0.863636364,0,0