label,id,name,username,bio,location,url,join_date,join_time,tweets,following,followers,likes,media,private,verified,profile_image_url,background_image,color_number,face_detection,follower/following_ratio,b_key_count,i_key_countbusiness,187680111,Maurice Chism,CHISMGROUP,"We are here to educate, empower and enable small businesses to impact the world.  We provide information technology, marketing and management services.",,http://www.chismgroup.net,9/6/10,14:54:00,14636,2299,795,227,0,1,0,https://pbs.twimg.com/profile_images/516964340461629440/QmSoPkxP_400x400.jpeg,https://pbs.twimg.com/profile_banners/187680111/1399325864/1500x500,22033,1,0.345802523,5,1business,9.86E+17,Vader Mountain Capital,VaderCapital,,,,4/17/18,14:24:00,129,334,103,1,119,0,0,https://pbs.twimg.com/profile_images/986355137596837888/4SGwAIAv_400x400.jpg,https://pbs.twimg.com/profile_banners/986354838962393089/1524060193/1500x500,5620,0,0.308383234,0,0business,9.90E+17,FundSmart Software,FundSmart_Pro,516-453-6969  Customer Success Platform designed by Merchant Cash Advance professionals for the MCA space. ISO's and Funder's will increase productivity,,https://www.linkedin.com/company/fundsmart-software-inc/,4/26/18,8:54:00,41,656,97,128,4,0,0,https://pbs.twimg.com/profile_images/1007686622068916224/T9Jb8l0c_400x400.jpg,https://pbs.twimg.com/profile_banners/989533121199656962/1527178180/1500x500,13204,0,0.147865854,0,0business,9.91E+17,LendrzHub,LendrzHub,Business Financing Solutions,,https://www.lendrzhub.com,4/30/18,16:02:00,494,319,112,2186,90,0,0,https://pbs.twimg.com/profile_images/1118302863749345280/r9NTFyHa_400x400.png,https://pbs.twimg.com/profile_banners/991090563129618432/1558863312/1500x500,256,0,0.351097179,0,0business,9.87E+17,Fiji Ventures LLC,Fiji_Ventures,___________è’—’____Ô©,29456,https://fijiventuresllc.com,4/18/18,12:41:00,33,301,10,32,3,0,0,https://pbs.twimg.com/profile_images/986694211868098560/DdQ3NDWX_400x400.jpg,https://pbs.twimg.com/profile_banners/986691330637049857/1524081228/1500x500,16703,0,0.033222591,0,0business,8.50E+17,BOOMMSLAMMERZ,BOOMMNLOUD,"music,beatzinstrumentals,r&b,reggaedubset,chopped&screwed&sloweddown,traps,trills,twerksbeatz,bestzinternational,boombapsoldschoolhip-hop.",TAMPA FL,https://boommslammerz0.wixsite.com/killarmy,4/7/17,13:16:00,18538,4702,547,18679,17900,0,0,https://pbs.twimg.com/profile_images/1088099666753961985/9IghT1mg_400x400.jpg,,3367,0,0.116333475,0,0business,17324965,Brazilian-Am Chamber,brazilcham,"Fostering Brazil-US business since 1968. Networking, news and resources for all sectors of the economy. Visit our website for more info!","New York, NY",http://www.brazilcham.com,11/11/08,15:08:00,4338,1128,1921,158,652,0,0,https://pbs.twimg.com/profile_images/64182183/Chamberlogo_400x400.jpg,https://pbs.twimg.com/profile_banners/17324965/1471893059/1500x500,18906,0,1.703014184,0,0business,9.15E+17,BERK Labs,berklabs,You want more customers. We can help. Get a FREE one-hour marketing consultation. https://Berk.is___’öÎŒ_—_,hello@berk.is,https://berk.is/,10/2/17,17:33:00,24,45,30,20,20,0,0,https://pbs.twimg.com/profile_images/915012160283017216/EcRIPN2j_400x400.jpg,https://pbs.twimg.com/profile_banners/915011830925418502/1524512018/1500x500,237,0,0.666666667,1,1business,92346621,Village Capital,villagecapital,We___Î¢_—_’öÎå_—_’•Î¢re reinventing the system to back the #entrepreneurs of the future___Î¢_—_’öÎå_—_’Ü’_a future where business creates equity and long-term prosperity.,,http://www.vilcap.com,11/24/09,11:37:00,10676,10770,25526,4549,2021,0,0,https://pbs.twimg.com/profile_images/648902013321932801/FJaqMnRd_400x400.png,https://pbs.twimg.com/profile_banners/92346621/1525354087/1500x500,256,0,2.370102136,0,1business,386316812,Clover,clovercommerce,Run your business better with #CloverInYourCorner ___________èÎŒ’__—_’öÎå    Social Media Hours: 9am to 5pm ET - Monday through Friday,Sunnyvale,http://Clover.com,10/6/11,18:39:00,5460,6009,14320,7414,1241,0,1,https://pbs.twimg.com/profile_images/1054466434783473667/ZhbPMbsY_400x400.jpg,https://pbs.twimg.com/profile_banners/386316812/1524576754/1500x500,4157,0,2.383092029,0,0business,119536498,Blindbid Team,BlindbidService,"Small Business Gurus, tips,consulting, marketing, leads generation, anything to help your business grow. (http://twiends.com/blindbidservice___’öÎŒ_—_)",US,http://www.blindbid.com,3/3/10,15:19:00,6359,2819,2288,1,74,0,0,https://pbs.twimg.com/profile_images/1562294684/Blindbid_400x400.jpg,https://pbs.twimg.com/profile_banners/119536498/1378957623/1500x500,5959,0,0.811635332,1,1business,4771158332,The Only,WeAre_TheOnly,Canada's Leading Creative Agency we offer Web Design | Media Production | Digital Marketing | Wedding Photography Founder @_DannyGibson,,http://www.theonlycreativeconsultants.com/,1/16/16,17:39:00,127,3728,4206,74,76,0,0,https://pbs.twimg.com/profile_images/987009992183054339/s2mTrdmw_400x400.jpg,https://pbs.twimg.com/profile_banners/4771158332/1524156530/1500x500,256,0,1.128218884,0,0business,601206410,Experian's Clarity Services,ExperianClarity,"Experian's Clarity Services is a credit bureau that provides reporting on near-prime, non-prime and subprime consumers.","Clearwater, FL",http://www.clarityservices.com,6/6/12,12:01:00,1124,664,353,188,773,0,0,https://pbs.twimg.com/profile_images/1087776895163424773/fi6czyE9_400x400.jpg,https://pbs.twimg.com/profile_banners/601206410/1539275333/1500x500,4752,0,0.531626506,1,0business,9.83E+17,Business Capital USA,AshleyS11620348,"Business Capital USA 2207 Concord Pike, Suite 551 Wilmington, DE 19803 Telephone: 800-821-6460 Fax: (800) 821-6460 info@businesscapitalusa.com",,https://www.businesscapitalusa.com/,4/9/18,2:43:00,16,217,41,1,12,0,0,https://pbs.twimg.com/profile_images/984398660375953408/cIfyMg1R_400x400.jpg,https://pbs.twimg.com/profile_banners/983279197371023361/1523533970/1500x500,7094,0,0.188940092,1,0business,222131124,Centfy,Kopacentafrica,"Centfy is a virtual credit provider whose mission is to be the Financial Partner of choice for African professionals. Email us at: hello@kopacentafrica.com, DM",,http://www.kopacentafrica.com,12/2/10,7:06:00,3783,1047,461,492,197,0,0,https://pbs.twimg.com/profile_images/986568937868546048/3EhuEma5_400x400.jpg,https://pbs.twimg.com/profile_banners/222131124/1538645250/1500x500,39209,1,0.440305635,1,0business,2416375830,Houston LISC,LISC_Houston,"LISC Houston builds sustainable communities where people are proud to live, work, and raise families.",Greater Houston,http://www.lisc.org/houston/,3/28/14,12:43:00,1086,1105,670,559,302,0,0,https://pbs.twimg.com/profile_images/449633851925483520/7PldS-zp_400x400.jpeg,https://pbs.twimg.com/profile_banners/2416375830/1447432439/1500x500,15884,999,0.606334842,0,0business,893345701,SmBizAmerica___Î¢_—_’Ü’_ÎŒÎ¢,SmBizAmerica,Official #Twitter Account for @SmBizAmerica___Î¢_—_’Ü’_ÎŒÎ¢ #SmBiz #America #SmallBusinessNews #Marketing #SmallBusiness #SmallBusinessGrowth #Startups #MadeInAmerica ___________è_—_’ÜÎçÎŒ__â___________è_—_’ÜÎçÎŒ__è,United States of America,http://SmBizAmerica.com,10/20/12,7:19:00,22741,4782,4352,79718,2109,0,0,https://pbs.twimg.com/profile_images/1084098104293437441/mTC2HgHw_400x400.jpg,https://pbs.twimg.com/profile_banners/893345701/1547303901/1500x500,24392,0,0.910079465,0,0business,7.21E+17,InDebted,InDebtedHQ,A #fintech startup transforming the debt collection industry. We provide data driven collections technology and services.,"Sydney, New South Wales",https://www.indebted.co/,4/13/16,23:52:00,93,127,107,103,17,0,0,https://pbs.twimg.com/profile_images/1100899327914913792/gx9-XbWQ_400x400.png,,23,0,0.842519685,2,1business,8.87E+17,Four Colors of Money,4colorsofmoney,"Blog, podcast, videos  about #bootstrapping #grants #businessloan and #VentureCapital for #startups and #SmallBusiness",,http://fourcolorsofmoney.com,7/17/17,13:31:00,693,3919,762,217,424,0,0,https://pbs.twimg.com/profile_images/892120120860037122/6ZK8tdA__400x400.jpg,https://pbs.twimg.com/profile_banners/887047214341730306/1500327078/1500x500,8571,0,0.194437356,0,0business,9.85E+17,M Williams Group,mwilliamsgroup1,Power.Strength.Results,,,4/13/18,5:45:00,2,3872,867,0,1,0,0,https://pbs.twimg.com/profile_images/984775827903602688/WxcbHXk4_400x400.jpg,https://pbs.twimg.com/profile_banners/984774481951440896/1523623813/1500x500,5468,0,0.223915289,0,0business,263795110,Fundingtree.com,Fundingtree,http://Fundingtree.com___’öÎŒ_—_ is a  Debt & Equity Funding Marketplace Platform for Commercial Real Estate Companies seeking Funding Solutions.,"Westlake Village, CA, USA",https://www.fundingtree.com,3/10/11,11:13:00,3773,3986,1341,606,117,0,0,https://pbs.twimg.com/profile_images/1047684922314383360/wRJjZdQ9_400x400.jpg,https://pbs.twimg.com/profile_banners/263795110/1538622578/1500x500,7789,0,0.336427496,0,0business,47421744,TAG,TAGthink,"The Technology Association of Georgia serves 35,000 members statewide through 27 societies & more than 200 events annually. #WhereGALeads","Alpharetta, GA",https://www.tagonline.org/,6/15/09,12:36:00,22990,5877,12624,11411,3432,0,0,https://pbs.twimg.com/profile_images/656541555570794496/FTGjJglz_400x400.jpg,https://pbs.twimg.com/profile_banners/47421744/1540213397/1500x500,5561,0,2.148034712,0,0business,9.83E+17,FAMO,Famo_WWW,"FAMO. Clothing Brand. Skateboard clothing from t-shirts, caps to sweaters.  #TruckLife",Word Wide Weshino,,4/9/18,5:49:00,63,108,26,86,11,0,0,https://pbs.twimg.com/profile_images/1043183992487464960/kGYgn4-T_400x400.jpg,https://pbs.twimg.com/profile_banners/983325915210973184/1537528906/1500x500,43822,0,0.240740741,0,0business,9.76E+17,Fincruit,thisisfincruit,"Partner to fast-growing FinTech companies that are changing the world we live in, enabling them to build teams that align with their culture & values globally.",Global reach,http://www.fincruit.co/,3/20/18,13:42:00,81,845,166,180,1,0,0,https://pbs.twimg.com/profile_images/976199428292972544/Clpbw75C_400x400.jpg,https://pbs.twimg.com/profile_banners/976197429069479936/1521580975/1500x500,8618,0,0.196449704,0,0business,7.50E+17,Helen Marie,TheHelenMarieF,"The Helen Marie Foundation is a 501c3 not-for-profit centered around rendering critical assistance to artists, musicians and athletes in times of need.",United States,http://www.helenmariefoundation.org,7/4/16,7:41:00,44,194,40,5,3,0,0,https://pbs.twimg.com/profile_images/751257721660375040/iR_vnwgI_400x400.jpg,,11897,0,0.206185567,0,0business,9.82E+17,Blue Heron Bar & Grill,BarHeron,"The best kept secret, hidden gem in all the Snoqualmie Valley. We're a beautiful public golf course, amazing restaurant, bar, clubhouse with a wrap around deck.","Carnation, WA",,4/5/18,13:09:00,20,1203,147,28,18,0,0,https://pbs.twimg.com/profile_images/981995389191507968/qZjC9D1U_400x400.jpg,https://pbs.twimg.com/profile_banners/981987184734449664/1522960920/1500x500,97826,0,0.122194514,0,0business,8.71E+17,___Î_ÎŒÎéÎŒÎé____—¢ÎŒ’æÎŒ’Ä___Î_ÎŒ__ÇÎŒÎ¢(Kevin Ren),zhenghengtowel,"Yuanshi County Zhengheng Textile Co.,ltd, Founded in 2008, Located in South Industry Zone of Yuanshi Town,Shijiazhuang City. The Expert for Microfiber Products!","Yuanshi Town,Shijiazhuan City",,6/2/17,18:48:00,1235,3396,306,1,347,0,0,https://pbs.twimg.com/profile_images/872633839473917952/UiBt-wyo_400x400.jpg,https://pbs.twimg.com/profile_banners/870819381202243587/1514020517/1500x500,4284,0,0.090106007,0,0business,3097304819,Fireside Conference,firesideconf,"An annual off-the-grid invite only #retreat for #Startups, founders, CEOs, #Investors and media to disconnect, learn, and build relationships. Sept 5-8, 2019.","Ontario, Canada",,3/19/15,11:00:00,1989,1891,1922,7991,347,0,0,https://pbs.twimg.com/profile_images/834836062891606016/GyGrGRgQ_400x400.jpg,https://pbs.twimg.com/profile_banners/3097304819/1551929079/1500x500,3787,0,1.016393443,0,1business,8.31E+17,Wet and Wild cam,WetandWildcam,"Wet and Wild cam Hundreds of  sexy grils just waiting to be naughty with you,Plus join for free and were give you 125 credit towards your first live show !",,http://bit.ly/WetandWildcam2,2/12/17,6:41:00,93,1113,133,0,91,0,0,https://pbs.twimg.com/profile_images/830790563981045761/2GiKAsx6_400x400.jpg,https://pbs.twimg.com/profile_banners/830788848930152449/1486910975/1500x500,30832,1,0.119496855,0,0business,9.82E+17,The FundSource,thefundsource,___________è_—_’Ü’‚ÎŒÒ—___________è_—_’Ü’‚ÎŒ______________è_—_’Ü’‚ÎŒ___Working Capital,,http://www.thefundsource.com,4/5/18,10:42:00,19,53,13,16,4,0,0,https://pbs.twimg.com/profile_images/982022759290204161/ohRfxU9j_400x400.jpg,https://pbs.twimg.com/profile_banners/981950241749524480/1522967665/1500x500,4348,0,0.245283019,0,0business,8.32E+17,DigitalMatrixSystems,DMatrixSystems,Digital Matrix Systems provides a simple way to access and manage the data our clients need to make informed business decisions.  Access. Storage. Analytics.,,http://www.dms.net,2/14/17,9:16:00,842,656,198,930,221,0,0,https://pbs.twimg.com/profile_images/831557468127768577/GQWLOTwU_400x400.jpg,https://pbs.twimg.com/profile_banners/831552622490443776/1487093882/1500x500,8136,0,0.301829268,1,0business,9.64E+17,FinCryption,FinCryption,The New Standard in Crypto Security,,http://www.FinCryption.com,2/14/18,14:43:00,32,70,19,166,11,0,0,https://pbs.twimg.com/profile_images/971560487858008065/4tFzzrK9_400x400.jpg,https://pbs.twimg.com/profile_banners/963906682425405440/1522877723/1500x500,10684,0,0.271428571,0,0business,9.81E+17,The Otiv Group,TheOtivGroup,Management Consulting | Business Acquistion,"Orlando, FL",http://TheOtivGroup.com,4/3/18,7:55:00,47,99,31,119,0,0,0,https://pbs.twimg.com/profile_images/1028385858414694400/gatCDnmI_400x400.jpg,,28404,0,0.313131313,0,0business,3239122739,CentSai,CentSai,A digital finance community for #Millennials and #GenerationX | We teach #PersonalFinance via storytelling.,,http://centsai.com,5/6/15,10:01:00,16620,2874,6475,8343,3100,0,0,https://pbs.twimg.com/profile_images/1046852879095681024/boEvdB7M_400x400.jpg,https://pbs.twimg.com/profile_banners/3239122739/1547837514/1500x500,8905,0,2.25295755,1,0business,73973921,unitedfirstcapital,u1stcapital,Independent Commercial Finance Consultant.Commercial small balance real estate loans from $500k to over $2 million.,,http://www.unitedfirstcapital.com,9/13/09,14:00:00,1125,4557,1988,604,19,0,0,https://pbs.twimg.com/profile_images/890617649775824896/dX0Snd7t_400x400.jpg,https://pbs.twimg.com/profile_banners/73973921/1410572438/1500x500,13607,0,0.43625192,2,0business,2348769434,Elevate,ElevateCredit,Our innovative online credit solutions provide immediate relief to customers today and help them build a brighter financial future.,,http://www.elevate.com/,2/17/14,8:56:00,728,204,625,99,131,0,0,https://pbs.twimg.com/profile_images/482194797491265536/wo5KQkYq_400x400.jpeg,https://pbs.twimg.com/profile_banners/2348769434/1547570192/1500x500,7955,0,3.06372549,4,1business,9.77E+17,Accord Business Funding,AccordBF,"___________è_—_’Ü’‚ÎŒ’…% ISO Driven Direct Funder  *5% Bonus on First Funded Deal  *3% Bonus on Texas deals  *Hands-On Owners, Fast & Flexible  *Partner with a funder from Texas! ___________èÎŒÎ_ÎŒ_—_",,http://www.accordbf.com,3/23/18,12:44:00,716,689,440,470,53,0,0,https://pbs.twimg.com/profile_images/1110611223102537729/vDWsPfSw_400x400.png,https://pbs.twimg.com/profile_banners/977269886778007553/1558705804/1500x500,3253,0,0.638606676,0,0business,9.53E+17,influencegeek,influencegeek,"Full-service, organic online marketing agency for small and locally owned businesses. #SocialMediaMarketing #LocalMarketing #SmallBusiness #LocalBusiness",,http://www.influencegeek.com,1/14/18,19:20:00,1846,4148,1231,2803,1418,0,0,https://pbs.twimg.com/profile_images/957931947774287873/U2WS00NW_400x400.jpg,https://pbs.twimg.com/profile_banners/952742208024662016/1517223942/1500x500,6053,0,0.296769527,2,1business,8.97E+17,Bizloanly,BizBizLoanly,We Bizloanly! We help business owners find funding that best suits them. Call us at 877-897-4794 or email us at funded@Bizloanly.com,,,8/13/17,13:12:00,346,2712,254,76,53,0,0,https://pbs.twimg.com/profile_images/930920477161222144/Z3fwcmCT_400x400.jpg,https://pbs.twimg.com/profile_banners/896826869286404096/1510783586/1500x500,5967,0,0.093657817,2,0business,9.74E+17,MASSACREBeats,iMassacrebeats,we kill beats,,http://www.massacrebeats.com,3/15/18,14:12:00,109,977,75,90,57,0,0,https://pbs.twimg.com/profile_images/984615384551538688/WNZE_C2U_400x400.jpg,https://pbs.twimg.com/profile_banners/974392801214517250/1521683495/1500x500,225,0,0.076765609,0,0business,412286395,FreedomPay,freedompay,FreedomPay. Making #Payments Faster. Simpler. Safer. Smarter. The Most Advanced Digital #Customer-centric Payment Platform. Engage-Disrupt-Profit,Philadelphia & London,http://www.freedompay.com,11/14/11,6:02:00,1398,1233,811,534,404,0,0,https://pbs.twimg.com/profile_images/433369837348220928/8zRGWxiv_400x400.jpeg,https://pbs.twimg.com/profile_banners/412286395/1404165643/1500x500,2336,0,0.657745337,0,0business,464621591,Sphonic,sphonic,An innovative risk management platform built for the new digital economy #AML #KYC #Fraud #PSD2 All Your #RegTech in one place: https://vimeo.com/222659915___’öÎŒ_—_,London/Global,http://www.sphonic.com,1/15/12,4:51:00,1504,3699,1484,201,72,0,0,https://pbs.twimg.com/profile_images/799614189224464384/8ZDp7jI-_400x400.jpg,https://pbs.twimg.com/profile_banners/464621591/1558013673/1500x500,1924,0,0.401189511,1,0business,9.63E+17,Gravity Capital LLC,Gravity_Capital,Gravity Capital is a lending company that connects accredited investors to entrepreneurs by creating quick and transparent real estate funding.,"Orem, UT",http://www.gravitycapllc.com,2/12/18,9:22:00,43,174,58,44,16,0,0,https://pbs.twimg.com/profile_images/963115432507920385/o373tPYq_400x400.jpg,https://pbs.twimg.com/profile_banners/963101084288892928/1522302622/1500x500,256,0,0.333333333,3,2business,9.67E+17,Business Funding Relations,BFR_Funding,"Business Funding Relations is not a bank, it is a financial services provider focused on helping to solve the cash flow needs of our small business customers.",,http://businessfundingrelations.com,2/22/18,13:18:00,0,25,25,0,0,0,0,https://pbs.twimg.com/profile_images/967145337327468544/a9zL7lV6_400x400.jpg,,256,0,1,5,1business,8.27E+17,True North,TrueNorth_Tech,A global professional services firm building engineering teams who develop leading FinTech products. We are the proven leader in driving FinTech forward.,,http://www.truenorth.co/,2/2/17,5:32:00,2761,895,542,1206,1132,0,0,https://pbs.twimg.com/profile_images/923269603781832704/RlPMkvIp_400x400.jpg,https://pbs.twimg.com/profile_banners/827147726072717312/1553529633/1500x500,8724,0,0.605586592,2,0business,601115828,ttecFinance,ttecFinance,"Experiences delivered with trust and empathy. Our approach combines consulting, analytics, technology, and care services that align with brand objectives.",,http://www.ttec.com/industries/financial-services,6/6/12,9:53:00,678,1533,413,6,115,0,0,https://pbs.twimg.com/profile_images/950515902616805376/qZHyH2f0_400x400.jpg,https://pbs.twimg.com/profile_banners/601115828/1515700414/1500x500,2005,0,0.269406393,1,0business,3939085593,Grainis ltd. Hydrogen Bulgaria,o_hydrogen,"http://fuels.alle.bg___’öÎŒ_—_ - Hydrogen, MOH, http://basalt.alle.bg___’öÎŒ_—_ (Basalt-Fiber Composite) http://asteroid-mining.alle.bg___’öÎŒ_—_ http://spaceship.alle.bg___’öÎŒ_—_ smartcity.alle.b","Sofia, Bulgaria",https://fuels.alle.bg,10/12/15,10:48:00,2257,2332,341,1195,320,0,0,https://pbs.twimg.com/profile_images/917630657576259584/ixgm4wlf_400x400.jpg,https://pbs.twimg.com/profile_banners/3939085593/1540932227/1500x500,42437,0,0.146226415,0,0business,9.54E+17,Debt Management Partners (DMP),dmpcollect,Debt Management Partners (DMP) and our operating team has been a niche leading liquidator of delinquencies since 2004.,,https://dmpcollections.com/,1/17/18,10:52:00,18,611,162,13,10,0,0,https://pbs.twimg.com/profile_images/954460061832654848/c1nU79zk_400x400.jpg,https://pbs.twimg.com/profile_banners/953701617592930305/1516395914/1500x500,4823,0,0.265139116,1,0business,407882228,Profile Magazine,Profile_ExecMag,"Profile brings leadership stories to life through the voices of real people in business. Subscribe to our newsletter to learn from top leaders, every other Wed.",,http://www.profilemagazine.com/subscribe-to-newsletter,11/8/11,9:45:00,2345,2410,1105,8947,344,0,0,https://pbs.twimg.com/profile_images/796002440663351296/eJBMb555_400x400.jpg,https://pbs.twimg.com/profile_banners/407882228/1553705903/1500x500,234,0,0.458506224,0,0business,9.58E+17,Pacific Block Technology,pacific_block,"Dedicated to contribute to the Blockchain community.___________è_—_’Ü’‚ÎŒ___    Provide Blockchain technology support, Portfolio management and Quantitative trading consultation.___________èÎŒÎ_ÎŒ’_",,http://www.pacificblock.io,1/30/18,13:50:00,428,1437,169,248,2,0,0,https://pbs.twimg.com/profile_images/989510365062066177/w0nCIkkB_400x400.jpg,https://pbs.twimg.com/profile_banners/958457442010062849/1533753520/1500x500,12851,0,0.117606124,0,0business,785394552,Centric Bank,CentricBank,"We Revolve Around You! We are proud to be your independent, community bank. Proud member of the FDIC. #FinancingNewFrontiers #PAProud #SBA #PBA @DrCentricBank","Harrisburg, PA",http://www.centricbank.com,8/27/12,13:18:00,3385,1135,760,685,565,0,0,https://pbs.twimg.com/profile_images/2549928178/Centric_Bank_Twitter_400x400.jpg,https://pbs.twimg.com/profile_banners/785394552/1429226511/1500x500,20704,0,0.669603524,0,0business,284782736,Eric Hubbard,Viking_Advisors,Helping business owners to Protect and Grow their business so the owner and their employees can Live More & Worry Less.,Greater Chicago Area,http://www.linkedin.com/company/viking-advisors-llc,4/19/11,16:41:00,568,597,141,159,28,0,0,https://pbs.twimg.com/profile_images/1328515314/viking-ship_400x400.jpg,,47208,0,0.236180905,0,0business,9.63E+17,SiaPrimesupporter,SiaPrimesupport,"SiaPrime is decentralized cloud storage using the Sia protocol. Channel Personal opinion, unofficial* Hodler and supporter #Announcements #Exchange #Social",,http://siaprime.net,2/13/18,7:16:00,66,1005,193,21,20,0,0,https://pbs.twimg.com/profile_images/1093881777385598977/cVZOitf3_400x400.jpg,https://pbs.twimg.com/profile_banners/963431663987511302/1549636702/1500x500,10208,0,0.192039801,0,0business,9.66E+17,Bankit Capital,capital_bankit,"Bankit Capital is based in Atlanta, Georgia. We offer business loans throughout the country. We established our company in 2013,",,,2/19/18,18:08:00,141,442,36,16,85,0,0,https://pbs.twimg.com/profile_images/965770832030019584/VNCuqaSs_400x400.jpg,,6126,0,0.081447964,2,0business,2998888235,Onestopfundingshop,onestopfunding,"We are specialized in Creative Financing. Some of our major programs are Unsecured Personal Loan, Business Loan for Existing & Start-Up, Hard Money Loan and etc",Nationwide,http://www.onestopfundingshop.com,1/25/15,15:59:00,610,1802,330,1,138,0,0,https://pbs.twimg.com/profile_images/665632474060443649/5P1f5wYa_400x400.jpg,https://pbs.twimg.com/profile_banners/2998888235/1438755237/1500x500,15889,0,0.183129856,0,0business,2200700480,My Genius Test,mygeniustest,"When you follow your natural genius, #life becomes a joy. Take the #free, one minute #Genius #Test & #discover your Genius #entrepreneurs #mentoring #business",Global,https://goo.gl/BcGdKw,11/17/13,21:19:00,5122,77758,74260,1036,1070,0,0,https://pbs.twimg.com/profile_images/877815182344323072/i6iOzFnN_400x400.jpg,https://pbs.twimg.com/profile_banners/2200700480/1545120561/1500x500,10915,0,0.955014275,0,1business,115485498,Bibby Financial US,BibbyFinance_US,BFS is a leading independent financial services partner providing asset based lending and factoring to small and medium-sized companies. #BFSFundsAspirations,,http://www.bibbyusa.com,2/18/10,12:19:00,1069,368,745,662,328,0,0,https://pbs.twimg.com/profile_images/821714972900290560/000SHH9E_400x400.jpg,https://pbs.twimg.com/profile_banners/115485498/1547128332/1500x500,4920,999,2.024456522,5,1business,29723611,Accion in the U.S.,AccionUS,Accion connects entrepreneurs nationwide with the capital & business support they need to build a better future. For more info visit http://us.accion.org___’öÎŒ_—_,,http://us.accion.org,4/8/09,7:16:00,3565,1669,2712,2003,1300,0,1,https://pbs.twimg.com/profile_images/692714292844560384/bSInN_CF_400x400.jpg,https://pbs.twimg.com/profile_banners/29723611/1510083511/1500x500,5782,0,1.624925105,1,1business,9.67E+17,Ashur Advance,AshurAdvance,Specializing in funding small to medium sized Businesses across the United States,"Manhattan, NY",http://www.ashuradvance.com,2/22/18,9:19:00,0,155,0,0,0,1,0,https://pbs.twimg.com/profile_images/966725618120495105/X92BIvJ0_400x400.jpg,https://pbs.twimg.com/profile_banners/966724041649385472/1519320536/1500x500,5021,0,0,2,0business,19601406,"PerformLine, Inc.",PerformLine,World's leading #RegTech & #compliance platform for enterprises looking to mitigate regulatory risk and ensure brand safety across sales and marketing channels.,COMPLY2019,http://www.performline.com,1/27/09,8:56:00,6326,1507,1792,759,1588,0,0,https://pbs.twimg.com/profile_images/1070810058420817923/B5WqWWa__400x400.jpg,https://pbs.twimg.com/profile_banners/19601406/1558540052/1500x500,10486,0,1.189117452,2,1