label,id,name,username,bio,location,url,join_date,join_time,tweets,following,followers,likes,media,private,verified,profile_image_url,background_image,color_number,face_detection,follower/following_ratio,b_key_count,i_key_countbusiness,1.00E+18,ORICS Industries,ORICS3,ORICS Equipment is made in the USA ORICS is a leader and innovator in the field of Modified Atmosphere Packaging Machines (M.A.P.),,http://www.orics.com,6/4/18,13:46:00,315,1273,340,150,246,0,0,https://pbs.twimg.com/profile_images/1003987398282358784/eFjZd0iG_400x400.jpg,https://pbs.twimg.com/profile_banners/1003739708311171072/1528205584/1500x500,7748,0,0.267085625,0,0business,147647116,Business of Software,bosconference,"Business of Software Conferences.  Events about building great products and companies. Lots online. Offline in Boston and Cambridge, England.","Boston, MA",http://www.businessofsoftware.org,5/24/10,10:43:00,11825,4478,4561,2864,1978,0,0,https://pbs.twimg.com/profile_images/933376900705193984/PIoXRDze_400x400.jpg,https://pbs.twimg.com/profile_banners/147647116/1511369684/1500x500,11769,0,1.01853506,0,0business,1.07E+18,Paolo,Gerard07013536,Need a loan to finance your project? contact us today,Italy,,12/15/18,0:23:00,6,4967,403,0,0,0,0,https://pbs.twimg.com/profile_images/1088836958837714944/JmpM6-RH_400x400.jpg,https://pbs.twimg.com/profile_banners/1073856090406825984/1548433937/1500x500,28144,0,0.081135494,1,0business,2591716574,IMPACT Payments,PaymentsCareers,"The #Payments and #Fintech industries most trusted source for #jobs, #talent, and Market Trends since 2000. #recruitment #headhunter #tribes",,https://impactpaymentsrecruiting.com/,6/27/14,10:30:00,201,453,481,64,94,0,0,https://pbs.twimg.com/profile_images/1079826926158508032/ZGvvPBFL_400x400.jpg,https://pbs.twimg.com/profile_banners/2591716574/1556305811/1500x500,8796,0,1.061810155,0,0business,98314354,YFS Magazine,YFSMagazine,"The definitive digital magazine for startups, small business, and #entrepreneurship culture. Helping entrepreneurs build ambitious companies.",Worldwide,http://www.yfsmagazine.com,12/20/09,23:16:00,43378,7187,18289,6874,7494,0,0,https://pbs.twimg.com/profile_images/1091404605043367936/iWfAv2pT_400x400.jpg,https://pbs.twimg.com/profile_banners/98314354/1553353657/1500x500,256,0,2.544733547,1,1business,1.07E+18,Patricia - Funding Manager,PatriciaFunding,Providing small business owners with Alternative lending - Revenue based financing - Consolidation - Term loans - MCA - Lines of credit - Bank Loans ___________è_—_’Ü’‚ÎŒÎµ___Î¢’—’____Ô©___’…ÎŒ__èÎŒ’å___________è_—_’Ü’____’_,New York City,,11/27/18,22:26:00,77,652,185,31,13,0,0,https://pbs.twimg.com/profile_images/1067667668843536385/BYb43-U7_400x400.jpg,https://pbs.twimg.com/profile_banners/1067665936646328321/1556898734/1500x500,24301,0,0.283742331,3,0business,1.07E+18,equitivo,equitivo,The fintech advisers.,United Kingdom,http://www.equitivo.co.uk,12/14/18,10:21:00,18,283,54,11,0,0,0,https://pbs.twimg.com/profile_images/1073644872882622464/rbg_dhQE_400x400.jpg,https://pbs.twimg.com/profile_banners/1073644034911027202/1547806425/1500x500,5940,0,0.190812721,0,1business,9.10E+17,NudeWater ___Î¢_—_’Ü’_ÎŒÎ¢,NudeWaterGlobal,Incorporating #Blockchain To Help End The Water Crisis Together  | #FinTech | #GlobalWaterCrisis | Detox Your Mind ___________è_—_’Ü’‚ÎŒ___ & Change Your World,WorldWide,,9/19/17,5:10:00,757,236,69,1936,25,0,0,https://pbs.twimg.com/profile_images/913729326507593728/Ah3hkEph_400x400.jpg,https://pbs.twimg.com/profile_banners/910113957897261057/1506691779/1500x500,6071,0,0.292372881,0,0business,1.05E+18,P2PMarketData,P2PMarketData,Top 50+ P2P lending & equity platforms by total investments ___________èÎŒ’å_—_’Ü_—_ Help us map all Platforms of the World ___________è___’_ÎŒ’____________è___’____Ô©___________è___’_ÎŒ’å,,http://p2pmarketdata.com,10/20/18,11:27:00,10,397,116,11,0,0,0,https://pbs.twimg.com/profile_images/1097774588652634114/DDNvSXvO_400x400.png,,180,0,0.292191436,2,0business,3214449687,Constant Energy,constantenergy,Constant Energy provides affordable payment options for home energy upgrades.  #fintech #fintechlending #utilities #energyfinancing,,http://www.constantenergy.com,4/27/15,11:20:00,128,259,91,550,1,0,0,https://pbs.twimg.com/profile_images/637100140252254208/vgyAroSp_400x400.png,https://pbs.twimg.com/profile_banners/3214449687/1546706421/1500x500,2751,0,0.351351351,2,1business,176805136,CarterBurdenNetwork,CBurdenNetwork,"We promote the well-being of seniors 60 and older through a continuum of services, advocacy, arts and culture and volunteer programs.",New York City,http://www.carterburdennetwork.org,8/10/10,6:51:00,709,618,378,732,382,0,0,https://pbs.twimg.com/profile_images/1072908183348396033/KZ-2vgD9_400x400.jpg,https://pbs.twimg.com/profile_banners/176805136/1546447962/1500x500,3928,0,0.611650485,1,0business,1.06E+18,BlockchaInvest,_BlockchaInvest,BlockchaInvest - international blockchain companies & crypto projects looking to raise capital meet local investors & fund managers in a very intimate setting.,,http://www.blockchainvest.org,11/14/18,2:11:00,119,382,118,55,1,0,0,https://pbs.twimg.com/profile_images/1062659337737273345/4QUnMHqb_400x400.jpg,https://pbs.twimg.com/profile_banners/1062649195033694208/1542192477/1500x500,6051,0,0.308900524,1,1business,1.07E+18,The Fin Truth,FinTruths,A team of industry experts share the plain simple truth about money. Ask us anything!,"Toronto, Ontario",http://thefintruth.com,11/27/18,19:03:00,50,1565,562,51,46,0,0,https://pbs.twimg.com/profile_images/1070728952518463488/p1v0I9UO_400x400.jpg,https://pbs.twimg.com/profile_banners/1067615054227492869/1544116477/1500x500,4731,0,0.359105431,0,0business,1.07E+18,IM Venture Partners,IMVPartners,Venture Capital Fund,,http://www.imventurepartners.com,12/6/18,16:34:00,7,116,13,0,0,0,0,https://pbs.twimg.com/profile_images/1111642867464916993/gLhxypiO_400x400.png,https://pbs.twimg.com/profile_banners/1070838878960054272/1544143175/1500x500,814,0,0.112068966,0,0business,2350778936,Fanbank,myFanBank,Fanbank is empowering commerce for independent local businesses. Visit our site to become a Fanbank member today!,,http://Fanbank.com,2/18/14,14:54:00,1722,340,1030,433,376,0,0,https://pbs.twimg.com/profile_images/1045795548010176512/a6n-3J_E_400x400.jpg,https://pbs.twimg.com/profile_banners/2350778936/1557790619/1500x500,6587,0,3.029411765,1,0business,9.70E+17,Park Place Payments,parkplacepower,Park Place is transforming the lives of women and revolutionizing payment processing at the same time.,Taking America by storm,http://www.parkplacepayments.com,3/3/18,14:34:00,122,37,74,139,19,0,0,https://pbs.twimg.com/profile_images/970067388887580672/TYZKdCPf_400x400.jpg,https://pbs.twimg.com/profile_banners/970064935832055808/1521753923/1500x500,4762,0,2,0,0business,163354397,First 5000,First5000,"At First 5000, we bring together Australia___Î¢_—_’öÎå_—_’•Î¢s top medium-sized enterprises. Tweets from the Global Access Partners' team.","Sydney, Australia",http://www.first5000.com.au,7/5/10,22:40:00,2935,1277,584,34,2,0,0,https://pbs.twimg.com/profile_images/1335242570/first5000_square_400x400.png,https://pbs.twimg.com/profile_banners/163354397/1440982096/1500x500,3300,0,0.457321848,0,0business,1.05E+18,IndustryPRwire,IndustryPRwire,IndustryPRwire is a Global Market Research Press Release & News Service.Upload your press release at IndustryPRwire. #Marketresearch #News #Report #Analysis,USA,http://industryprwire.com/,10/1/18,22:21:00,1597,1511,190,3,98,0,0,https://pbs.twimg.com/profile_images/1074544508186947584/DemEaU1Q_400x400.jpg,https://pbs.twimg.com/profile_banners/1046993495234351104/1556210727/1500x500,2737,0,0.12574454,0,0business,1.07E+18,Two Players,TwoPlayersnz,Community Organisation,"Auckland, New Zealand",,12/3/18,3:42:00,0,37,10,3,0,1,0,https://pbs.twimg.com/profile_images/1069558287874457600/wz2Xd0vn_400x400.jpg,https://pbs.twimg.com/profile_banners/1069557451165380608/1543837556/1500x500,4473,0,0.27027027,0,0business,1.04E+18,Upperstate,TheUpperstate,Upperstate is a design and manufacturer of assistive walking devices that help individuals better traverse their environments. Fall 2019.,,,9/15/18,15:16:00,21,657,74,72,5,0,0,https://pbs.twimg.com/profile_images/1060645474020024321/xKSeudwb_400x400.jpg,https://pbs.twimg.com/profile_banners/1041088350176858112/1542127370/1500x500,226,0,0.112633181,1,0business,1002878384,Jambos Communication,jambos6,"Welcome to Jambos Communications, Your suggested Telecommunications Provider.",,https://www.djfhometheater.com,12/10/12,15:53:00,326,85,23,5,148,0,0,https://pbs.twimg.com/profile_images/664966842537132032/4-aLLzVf_400x400.png,https://pbs.twimg.com/profile_banners/1002878384/1451940540/1500x500,2049,0,0.270588235,0,0business,4406275036,Salon 1738,Salon1738,,"Palm Harbor, Florida",http://salon1738.glossgenius.com,12/7/15,7:42:00,120,73,25,162,6,0,0,https://pbs.twimg.com/profile_images/932363142969118720/vJ9dhrdu_400x400.jpg,,60499,0,0.342465753,0,0business,15502236,Joan Timmerman,jtimmerman,Broker/Owner of Premier Properties in Greenwood SC.,Greenwood SC,http://www.GreenwoodSCRealEstate.com,7/20/08,7:15:00,1272,662,122,257,0,1,0,https://pbs.twimg.com/profile_images/1083448565039538176/g71yo5___400x400.jpg,,15787,0,0.18429003,0,0business,1.06E+18,brainbrandheadwear,brainbrandhw,Headwear Company___________è_—_’Ü’_ÎŒ_—¢___________èÎŒ’™ÎŒ_—_ Based in Dallas ___Î¢_—_’öÎåÎŒÎ¢ Made in Denver ___Î¢_—_’öÎåÎŒÎ¢ Worn everywhere.,"Dallas, TX",http://www.brainbrandheadwear.com,11/1/18,10:01:00,168,163,47,636,41,0,0,https://pbs.twimg.com/profile_images/1088603446335455232/5gnE6rxS_400x400.jpg,https://pbs.twimg.com/profile_banners/1058041383351664645/1551333313/1500x500,14888,0,0.288343558,0,0business,1.07E+18,dibblebiz Group,dibblebiz,Venture Capital. We dibble the business of tomorrow.,,http://www.dibblebiz.com,11/21/18,17:17:00,12,252,62,8,5,0,0,https://pbs.twimg.com/profile_images/1072586996659437568/cvEwzKaw_400x400.jpg,https://pbs.twimg.com/profile_banners/1065413844443500544/1543708850/1500x500,6362,0,0.246031746,0,0business,1.06E+18,SolitaryOak,SolitaryOak,Banking | Real Estate | Finance,,,11/12/18,4:43:00,58,167,22,113,10,0,0,https://pbs.twimg.com/profile_images/1099762879119675392/TPH0_X22_400x400.jpg,https://pbs.twimg.com/profile_banners/1061962641202204674/1551038082/1500x500,256,0,0.131736527,0,0business,89666720,Ping HD,PingHD,Ping HD is a full-service digital signage solutions company. We design and build digital experiences that transform the way consumers interact with business.,"Denver, CO",http://www.pinghd.com,11/13/09,1:55:00,968,1546,827,1351,264,0,0,https://pbs.twimg.com/profile_images/1110587044663705600/uxR_O7DI_400x400.png,https://pbs.twimg.com/profile_banners/89666720/1553619668/1500x500,246,0,0.534928849,2,0business,7.59E+17,CODIX,CODIX_SA,CODIX is the market leading software editor of iMX: the unique event-driven business management system for debt collection and commercial finance business.,,https://www.codix.eu,7/29/16,6:04:00,245,950,142,152,226,0,0,https://pbs.twimg.com/profile_images/768466863995101184/aqahFQX3_400x400.jpg,https://pbs.twimg.com/profile_banners/759011653123842048/1549024619/1500x500,7603,0,0.149473684,2,0business,8.83E+17,Agohra,agohra2,,,http://www.agohra.com,7/5/17,8:41:00,53,947,178,9,47,0,0,https://pbs.twimg.com/profile_images/904692255012814848/rzu0vhLV_400x400.jpg,https://pbs.twimg.com/profile_banners/882625388698099712/1532360656/1500x500,4361,0,0.187961985,0,0business,1.06E+18,FlipSimpli,FlipSimpli,,,,10/31/18,7:56:00,151,115,22,0,33,0,0,https://pbs.twimg.com/profile_images/1063184626146000898/K2jJru4e_400x400.jpg,https://pbs.twimg.com/profile_banners/1057647384417710081/1542318556/1500x500,3836,0,0.191304348,0,0business,82771452,ThrottleNet Inc.,throttlenet,"IT News, Trends, Best Practices #ITSecurity #ITSolutions,   Providing Managed IT + Security in #STL for nearly 20 years.   #cybersecurity #stlbiz","St. Louis, MO",http://www.throttlenet.com,10/15/09,19:03:00,1795,2043,1744,442,348,0,0,https://pbs.twimg.com/profile_images/1133457203254444032/KgvrOy7k_400x400.png,https://pbs.twimg.com/profile_banners/82771452/1559072218/1500x500,930,0,0.853646598,0,0business,1.07E+18,MavenGray,Maven_Gray,MavenGray connects business owners with tech solutions for administrative burdens.,,http://www.mavengray.com,11/24/18,12:10:00,38,72,16,0,1,0,0,https://pbs.twimg.com/profile_images/1067992190121439233/7frdKZee_400x400.jpg,https://pbs.twimg.com/profile_banners/1066423757521088513/1543104601/1500x500,1299,0,0.222222222,1,0business,381780750,bayareamade,Bayareamade,"Real Localization, is what is happening in Oakland/San Francisco Bay. If you make it sell it ..here. Still in Beta since 2012",San Francisco Bay Area,,9/28/11,15:50:00,3779,2043,706,173,356,0,0,https://pbs.twimg.com/profile_images/3060270615/a7204b223d7c0f59464bdb655a5e0fd5_400x400.png,https://pbs.twimg.com/profile_banners/381780750/1348795736/1500x500,256,0,0.34557024,0,0business,98345300,The Paypers,ThePaypers,"The leading independent source of news and analysis for professionals in the global #payments, #fintech and #commerce community. #Amsterdam",Global,http://www.thepaypers.com,12/21/09,2:31:00,27311,6281,24636,2134,2799,0,0,https://pbs.twimg.com/profile_images/915487766846300160/9Vf8_M-I_400x400.jpg,https://pbs.twimg.com/profile_banners/98345300/1492066206/1500x500,833,0,3.922305365,1,1business,9.67E+17,Alpha OmegaEnergy,AOECOIN,"#1 Impact Investment on Earth, CleanTech Startup in SouthEast Asia with 2,867 Breakthrough Clean Techs, Seeks Finance Lines, Networks, and Support Pre-IPO",Cambodia,,2/22/18,1:55:00,8623,5003,555,9608,2020,0,0,https://pbs.twimg.com/profile_images/966621504082292736/AORup329_400x400.jpg,https://pbs.twimg.com/profile_banners/966612436978581504/1519474303/1500x500,55840,0,0.11093344,0,0business,1.03E+18,AdLink Solutions,AdLinkMarketing,"By utilizing tracking engagements, clicks, real time analytics, influencers and impressions, our company tracks every aspect of a campaign___Î¢_—_’öÎå_—_’•Î¢s performance.","Munich, Bavaria",https://adlinksolutions.com,8/11/18,3:45:00,13,940,567,10,13,0,0,https://pbs.twimg.com/profile_images/1028235218078105602/puCQ6RzE_400x400.jpg,https://pbs.twimg.com/profile_banners/1028230828323741696/1542727711/1500x500,9311,0,0.603191489,1,0business,7.87E+17,Sempli,sempli_co,"Digital, simple y oportuno. El nuevo est___’_ÎŒÎçndar en cr___’_ÎŒÎ©dito empresarial #CrecerSimple",Colombia,http://www.sempli.co,10/14/16,18:33:00,1000,55,1890,482,424,0,0,https://pbs.twimg.com/profile_images/1036447471562629120/lPnPWXxh_400x400.jpg,https://pbs.twimg.com/profile_banners/787104028287176704/1535943325/1500x500,3361,0,34.36363636,0,0business,2950553700,Lumity Benefits,LumityBenefits,"Data drives better #benefits decisions. Technology, paired with attentive service, can reduce #healthinsurance costs for both #employers and employees.",,http://www.lumity.com,12/29/14,8:34:00,545,1202,449,450,158,0,0,https://pbs.twimg.com/profile_images/1014196445035892736/S7AQacD6_400x400.jpg,https://pbs.twimg.com/profile_banners/2950553700/1549405482/1500x500,4067,0,0.373544093,0,0business,1.03E+18,Waterwood Properties LLC,LlcWaterwood,"My name is Jerico Scott, I am the Founder and CEO of WaterWood Properties.",,http://waterwoodproperties.com,8/26/18,9:12:00,15,241,54,1,4,0,0,https://pbs.twimg.com/profile_images/1033750557087789056/zOi1udob_400x400.jpg,https://pbs.twimg.com/profile_banners/1033749010178289665/1535301276/1500x500,28735,1,0.22406639,0,0business,840188174,NCFA Canada,NCFACanada,"Education, Networking, Services & Opportunities in FinTech, Blockchain, Crypto, Crowdfinance, Funding, Lending & P2P.  #VF2018 #FFCON19",Canada,http://ncfacanada.org,9/22/12,11:03:00,23352,3762,6240,9537,3296,0,0,https://pbs.twimg.com/profile_images/957791725874855936/4W3A4djV_400x400.jpg,https://pbs.twimg.com/profile_banners/840188174/1556597941/1500x500,7064,0,1.658692185,1,0business,1349519251,ZMB STORE,ZBMSTORE,"We specialize in Advertising, Creative, Strategic Planning, Social, Digital Design, Development, Media Planning, Media Buying, Response Planning .","Long Beach, Ca",http://www.zbestmedia.com,4/13/13,8:26:00,155,550,64,43,32,0,0,https://pbs.twimg.com/profile_images/610487297977376769/2Q816rD7_400x400.png,https://pbs.twimg.com/profile_banners/1349519251/1434386638/1500x500,2331,0,0.116363636,0,0business,9.95E+17,Bancamovi,BancaMovi,"Central America's first, REAL #DIGITAL #BANK! Coming soon!",Latam,,5/12/18,5:38:00,0,1263,115,2,0,0,0,https://pbs.twimg.com/profile_images/1062717574012522501/BWlJUfZd_400x400.jpg,https://pbs.twimg.com/profile_banners/995282085467258880/1542210163/1500x500,29220,0,0.091053048,0,0business,531712932,FP Complete,FPComplete,Working to drive the successful commercial adoption of Haskell at large scale.,"USA, Europe, Israel, Canada",http://www.fpcomplete.com/blog,3/20/12,13:50:00,2112,1851,5800,1547,40,0,0,https://pbs.twimg.com/profile_images/1916864520/Icon_Only_small_400x400.png,https://pbs.twimg.com/profile_banners/531712932/1400747955/1500x500,9024,0,3.133441383,0,0business,9.58E+17,Compilation Avenue,CompilationAven,,,,1/29/18,0:17:00,9,1954,69,1,0,0,0,https://pbs.twimg.com/profile_images/957904325417693185/COA_RwMN_400x400.jpg,https://pbs.twimg.com/profile_banners/957890366094454784/1517217161/1500x500,9341,0,0.03531218,0,0business,1.06E+18,"My Dealer Services, LLC",DealerLlc,"My Dealer Services, LLC is an F & I Solutions Company Serving The RV- Marine & Horse Trailer Dealerships Throughout The United States.",,,11/3/18,11:06:00,191,4438,641,62,2,0,0,https://pbs.twimg.com/profile_images/1058783527099977728/erNaAHmp_400x400.jpg,,11187,0,0.14443443,0,0business,9.56E+17,Online Loans,OnlineLoans,Online Loans Inc.,Nationwide,http://OnlineLoans.com,1/22/18,14:20:00,2,48,6,5,0,0,0,https://pbs.twimg.com/profile_images/956901064573374464/6i4l08GF_400x400.jpg,,5262,0,0.125,0,0business,9.43E+17,Capital Boost,CBH_Australia,Capital Boost is a personalised brokerage service delivering unsecured business loans for small and medium businnes in Australia.,,http://www.capitalboost.com.au,12/19/17,0:59:00,57,129,38,1,40,0,0,https://pbs.twimg.com/profile_images/1094962682036436999/FYBCUNyr_400x400.jpg,https://pbs.twimg.com/profile_banners/943043078478217216/1549894745/1500x500,2162,0,0.294573643,2,0business,1849324789,Garnet Capital,GarnetCapital,A leading financial-services company specializing in managing loan portfolio sales and providing valuation services to banks and other credit grantors.,Headquarters - New York,http://garnetcapital.com,9/9/13,13:08:00,5958,798,365,175,0,1,0,https://pbs.twimg.com/profile_images/461167658465886208/kPM2e61N_400x400.png,https://pbs.twimg.com/profile_banners/1849324789/1505327031/1500x500,10464,0,0.457393484,4,1business,1.05E+18,MoneyGator,moneygatorblog,Personal finance blog that is chompin' away blogging about the latest in personal finance. #idontbite #ilovefinance #financenerd #realestate,United States,https://www.moneygator.net,10/19/18,18:13:00,41,946,356,49,6,0,0,https://pbs.twimg.com/profile_images/1058788162435235842/5zltgzdl_400x400.jpg,https://pbs.twimg.com/profile_banners/1053454143938007040/1541269596/1500x500,11154,0,0.376321353,1,0business,1.05E+18,Consumer Home Value,consumerhmvalue,Welcome to Consumer Home Value! A Resource to help you better understand your Home Value. Browse through blogs and articles by Real Estate Appraisers.,,Https://consumerhomevalue.com,10/19/18,12:04:00,511,2532,339,336,207,0,0,https://pbs.twimg.com/profile_images/1075406056409497601/WVq_f9Qx_400x400.jpg,https://pbs.twimg.com/profile_banners/1053361368345264129/1545231759/1500x500,14557,0,0.133886256,1,0business,9.93E+17,CANIPlatform,CaniPlatform,#CANIPlatform is Leveraging Tech  to close some of the gaps observed in Nigeria___Î¢_—_’öÎå_—_’•Î¢s  education pattern notably by bridging the gap between students & workplace.,Nigeria ,http://canipf.org.ng,5/6/18,1:30:00,133,496,61,241,12,0,0,https://pbs.twimg.com/profile_images/1054284635411234818/QaSGtsXZ_400x400.jpg,https://pbs.twimg.com/profile_banners/993045344555536385/1539094998/1500x500,43815,0,0.122983871,0,0business,9.69E+17,Business Loan Insider,BizLoanInsider,Financing Private Businesses Since 2011,,http://www.businessloaninsider.com,3/1/18,12:51:00,17,85,23,1,0,0,0,https://pbs.twimg.com/profile_images/989281229945098240/aT-d2syP_400x400.jpg,https://pbs.twimg.com/profile_banners/969314214367105024/1524698019/1500x500,15465,0,0.270588235,0,0business,8.12E+17,Achen Henderson CPAs,AchenHenderson,We help build great companies.  Professional Accountants + Business Advisors. Advanced Technology + Strategic Alliances.  #DitchAccounting ___Î¢ÎŒÎå_—_’ÜÎç___’…ÎŒ__èÎŒ’å,"Calgary, Alberta",http://www.achenhenderson.ca/blog,12/22/16,16:50:00,237,480,278,244,27,0,0,https://pbs.twimg.com/profile_images/1001560900963201024/BDmmHUqH_400x400.png,https://pbs.twimg.com/profile_banners/812098016412766208/1527713144/1500x500,6386,0,0.579166667,1,0business,2936253764,IELTS TRAINING SERVICES,ielts_training,"IELTS TRAINING SERVICES provide Business English, General English and IELTS Preparation Courses as well as Migration Package Documents and Elite English Club.",,http://www.ieltstrainingservices.com/,12/19/14,8:14:00,765,502,503,122,200,0,0,https://pbs.twimg.com/profile_images/626793892235608064/vuL4yiiv_400x400.jpg,https://pbs.twimg.com/profile_banners/2936253764/1532796863/1500x500,2219,0,1.001992032,1,0business,85606078,U.S. Chamber,USChamber,"We___Î¢_—_’öÎå_—_’•Î¢re the world's largest business federation, representing the interests of 3 million businesses. We___Î¢_—_’öÎå_—_’•Î¢re focused on policies that create jobs & grow the economy","Washington, D.C.",http://www.uschamber.com,10/27/09,9:35:00,39305,4502,156905,8254,11700,0,1,https://pbs.twimg.com/profile_images/950793276218540032/ztFiPSvp_400x400.jpg,https://pbs.twimg.com/profile_banners/85606078/1558108279/1500x500,10204,0,34.85228787,1,0business,3249294152,Kukun,MyKukun,"Threading the industries together that make #homeremodeling possible for the customer. Real Estate, Loan, Construction and Retail.","Menlo Park, CA",https://mykukun.com,6/18/15,17:29:00,5764,2135,2301,4655,2904,0,0,https://pbs.twimg.com/profile_images/1105162665725489155/C1SBohVI_400x400.png,https://pbs.twimg.com/profile_banners/3249294152/1528383720/1500x500,4272,0,1.077751756,0,0business,859425817,MECICO KUWAIT,MECICOKUWAIT,"Kuwait Debt Collection, Anti-Fraud  & Credit Reporting",,http://mecico-kuwait.com,10/3/12,2:22:00,230,4793,685,369,57,0,0,https://pbs.twimg.com/profile_images/2676040312/7835c412fd71c470bb3493bb81a54c2b_400x400.jpeg,,48455,0,0.142916754,0,0business,1.04E+18,DeborahCEO,DeborahCEO1,"Non profit organization, raise funds to help students with scholarships, National and Caribbean Islands. God___Î¢_—_’öÎå_—_’•Î¢s Foreign College Foundation.","North Carolina, USA",http://godsforeigncollegefoundatio.com,8/31/18,18:48:00,19,57,11,12,4,0,0,https://pbs.twimg.com/profile_images/1035706547547111424/tLSmC6Dd_400x400.jpg,,3404,0,0.192982456,1,0business,63796828,Twitter Verified,verified,Twitter is working on a new authentication and verification process. Learn more: https://twitter.com/TwitterSupport/status/930926225517719552___’öÎŒ_—____Î¢_—_’öÎåÎŒÎ_,San Francisco,,8/7/09,11:41:00,6,323540,2678280,5,0,0,1,https://pbs.twimg.com/profile_images/968232588958560256/IfOqS8l2_400x400.jpg,https://pbs.twimg.com/profile_banners/63796828/1519679636/1500x500,3468,0,8.278049082,0,0business,1.05E+18,Value My Business Now,now_value,Value My Business Now is a free to use service with advice on how to buy or sell a business including a free business valuation tool,Hampshire,http://www.valuemybusinessnow.com,10/11/18,4:16:00,36,95,32,29,1,0,0,https://pbs.twimg.com/profile_images/1050349446633050112/e7FPIRQO_400x400.jpg,https://pbs.twimg.com/profile_banners/1050344503872315393/1539257798/1500x500,9392,0,0.336842105,0,0business,9.66E+17,EntrepreNoSleep,epnosleep,A simple shop & fundraising engine for the Midnight Miner Contest___Î¢_—_’öÎå_—_’Ü’_ built to bankroll entrepreneurs. Learn more at,,http://epnosleep.com,2/20/18,1:42:00,15,89,31,88,7,0,0,https://pbs.twimg.com/profile_images/1046913970106331136/QVpHLboK_400x400.jpg,https://pbs.twimg.com/profile_banners/965884260816048128/1538978002/1500x500,5868,0,0.348314607,0,1business,9.78E+17,MerchFi,MerchFi,Lending Redefined. Short Term loans | Lines of Credit | Merchant Advances | All Business Types welcome. @merchfiapply on FB (954-357-2866___Î¢_—_’öÎå_—_’ÜÒ—___Î¢_—_’öÎå_—_’ÜÒ—___Î¢_—_’öÎå_—_’ÜÒ—),,http://merchfi.com/,3/24/18,11:44:00,445,1642,246,293,112,0,0,https://pbs.twimg.com/profile_images/1049475094760869893/mot0V2O9_400x400.jpg,https://pbs.twimg.com/profile_banners/977617252613853184/1549491363/1500x500,7756,0,0.149817296,1,0business,631282076,Leon Hunter SL,LeonHunterSL,Traducci___’_ÎŒ__Çn jurada y mucho m___’_ÎŒÎçs. #Translation #Espa___’_ÎŒÎ±ol #Languages,Madrid,http://www.leonhunter.com/,7/9/12,10:50:00,49290,16783,16557,211872,1572,0,0,https://pbs.twimg.com/profile_images/867874046226178048/Tj1XeKvS_400x400.jpg,,9577,0,0.986533993,0,0business,1.05E+18,Thirty Four,thirtyfournews,UK Financial Services News,,,10/16/18,1:17:00,82,124,28,4,0,0,0,https://pbs.twimg.com/profile_images/1052134948726079488/XtfKOGby_400x400.jpg,https://pbs.twimg.com/profile_banners/1052111324933775360/1539964826/1500x500,3953,0,0.225806452,0,0