label,id,name,username,bio,location,url,join_date,join_time,tweets,following,followers,likes,media,private,verified,profile_image_url,background_image,color_number,face_detection,follower/following_ratio,b_key_count,i_key_countbusiness,21621749,Beef Ent.,BeefEnt,"Beef Ent. - Rhode Island #1 Independent Music Label. Rhode Island Booking, Promotion, We do invest money in talent! Subscribe at youtube!",beefentertainment@mail.com,https://www.youtube.com/watch?v=wrk900PrWvQ&list=PL_fjiSn8KaUopkd6jfoQQuZ-1SPwoef3e,2/22/09,17:58:00,408874,471518,169139,450265,58500,0,0,https://pbs.twimg.com/profile_images/957995998781100033/U1L4_fxf_400x400.jpg,https://pbs.twimg.com/profile_banners/21621749/1479220462/1500x500,21115,1,0.35871165,0,0business,8.27E+17,SmallBizFinanceAssn,FundMainStreet,We support alternative finance companies that deliver responsible and efficient capital to small businesses.,"Washington, DC",http://www.sbfassociation.org,2/1/17,13:05:00,51,111,376,1,3,0,0,https://pbs.twimg.com/profile_images/845285247369535488/4uTuXhR4_400x400.jpg,https://pbs.twimg.com/profile_banners/826899280027873280/1490364187/1500x500,256,0,3.387387387,5,0business,55281790,Elf,elfproductions,Digital creative agency. We work with clients to inspire the future. Designed with Love___Î¢_—_’Ü’_ÎŒÎ¢  #elfagency #elf #haydens #stardust #atomgames,,http://www.elf.agency,7/9/09,9:23:00,2904,1884,7713,1451,523,0,0,https://pbs.twimg.com/profile_images/460137326979465216/iFkxpuLR_400x400.png,https://pbs.twimg.com/profile_banners/55281790/1515066761/1500x500,2770,0,4.093949045,0,0business,7.44E+17,Loan Frame,LoanFrame,India's leading #smallbusiness #digital #lending platform getting #smes the right #finance #fast. #fintech,"Gurgaon, India",http://www.loanframe.com,6/16/16,23:58:00,79,314,2037,32,6,0,0,https://pbs.twimg.com/profile_images/743702185469304832/s1Zvouj2_400x400.jpg,,3422,0,6.487261146,5,1business,7.79E+17,Open Up Challenge,OpenUpChallenge,"We're a fintech prize fund backing next generation services, apps and platforms for SMEs.  http://openupchallenge.io___’öÎŒ_—_ ___________èÎŒ’å_—_’Ü_—_ http://medium.com/o-p___’öÎŒ_—_ ___________è_—_’Ü’Â___’____’…ÎŒ__èÎŒ’å  by @nesta_uk",,http://openup.challenges.org,9/23/16,2:22:00,236,1282,1394,175,24,0,0,https://pbs.twimg.com/profile_images/992391764827877376/sa4aWeOg_400x400.jpg,https://pbs.twimg.com/profile_banners/779249558589243392/1525439622/1500x500,2444,0,1.087363495,2,1business,93461360,U.G.E.S. LLC.,ProtectMySpot,#Free Valuable #Information on how to get #Cash #Gold by the gram or more and #CryptoCurrency for #FREE by #Saving #Money and #Sharing how to do it with others.,,http://www.TheRealMoney.online/ugesllc/learn-more,11/29/09,11:20:00,9738,2725,1083,1796,0,0,0,https://pbs.twimg.com/profile_images/1132373965861720065/qVs_4PsJ_400x400.png,https://pbs.twimg.com/profile_banners/93461360/1559093731/1500x500,48848,999,0.397431193,0,0business,4234876996,American Merchant,AmericanMct,American Merchant Center is a leader in the payment processing industry because we have the experience and expertise for fast processing and the lowest fees!,,http://www.americanmerchant.com/,11/20/15,5:39:00,188,2183,322,0,178,0,0,https://pbs.twimg.com/profile_images/839008928436482048/dEyUSJQX_400x400.jpg,https://pbs.twimg.com/profile_banners/4234876996/1489472000/1500x500,7162,0,0.147503436,0,0business,3881572572,PitchBooks,PitchBooks_IN,"Pitchbooks is a global professional services provider offering customized presentations, research and financial services to corporates & financial institutions.",,http://www.pitchbooks.in/,10/13/15,7:52:00,26,270,112,101,0,0,0,https://pbs.twimg.com/profile_images/871142418908938241/CNDDnZdN_400x400.jpg,https://pbs.twimg.com/profile_banners/3881572572/1496531536/1500x500,8163,0,0.414814815,3,1business,8.42E+17,Planafund,planafund,Plan A Fund Inc. is your only source of business financing. Our platform is built on over a decade of customer feedback and industry experience.,"New York, USA",http://www.planafund.com,3/14/17,18:09:00,8,106,26,7,0,0,0,https://pbs.twimg.com/profile_images/841820675379761153/lMkKOS6E_400x400.jpg,https://pbs.twimg.com/profile_banners/841818700718198785/1489547087/1500x500,6668,0,0.245283019,1,0business,2409156164,CloserIQ,CloserIQ,CloserIQ is a modern recruitment firm that connects top #sales talent to the world___Î¢_—_’öÎå_—_’•Î¢s fastest growing companies.,NYC,https://closeriq.com,3/24/14,8:16:00,8300,4141,4341,4063,1620,0,0,https://pbs.twimg.com/profile_images/1045731400479989760/iCQa7wDM_400x400.jpg,https://pbs.twimg.com/profile_banners/2409156164/1408113749/1500x500,5378,999,1.048297513,0,0business,115149140,PRmediaNow,PRmediaNow,,,http://www.prmedianow.com,2/17/10,11:30:00,1521,329,373,23,15,0,0,https://pbs.twimg.com/profile_images/752966380295684096/TqFRJar0_400x400.jpg,,5353,0,1.133738602,0,0business,8.32E+17,Online Lending Policy Institute,OLPI_Staff,OLPI encourages responsible innovation in online lending through thought leadership and fostering a meaningful dialogue,"Washington, DC",http://www.olpi.info,2/16/17,15:01:00,497,1946,632,225,58,0,0,https://pbs.twimg.com/profile_images/832365437291724804/ecrzKUQ7_400x400.jpg,https://pbs.twimg.com/profile_banners/832364398832390144/1557175858/1500x500,7596,0,0.324768756,1,0business,8.29E+17,Loans of the Day,loansoftheday,"We use Big Data, Predictive Analytics, Artificial Intelligence, and Machine Learning to distribute risk and optimize returns. Lending online since 2008.",,https://loansoftheday.com/,2/7/17,14:55:00,2436,204,50,30,1,0,0,https://pbs.twimg.com/profile_images/837674559914532864/INZ94F7U_400x400.jpg,,4942,0,0.245098039,0,0business,529404674,NEXT Franchise,NEXTFranchise,Your affordable #franchising exerts.   Developing small businesses into successful franchises is what we do. Is your #franchise NEXT?,USA,http://nextfranchisesystems.com,3/19/12,7:02:00,390,960,523,66,89,0,0,https://pbs.twimg.com/profile_images/838828348293976064/X03Ill2-_400x400.jpg,https://pbs.twimg.com/profile_banners/529404674/1488827341/1500x500,8419,0,0.544791667,3,0business,7.67E+17,LendingPoint,LendingPoint,"We founded LendingPoint to provide better financial solutions to more people. To us, you___Î¢_—_’öÎå_—_’•Î¢re more than a credit score.",,https://www.lendingpoint.com/,8/19/16,7:46:00,2021,1069,790,1258,763,0,0,https://pbs.twimg.com/profile_images/819619852721631232/Bj01cya2_400x400.jpg,https://pbs.twimg.com/profile_banners/766647572383621120/1471619546/1500x500,5274,0,0.739008419,3,1business,8.33E+17,Loanfully,loanfully,We are corporate lending consultants that help all types of businesses from all over the United States.,,http://www.Loanfully.com,2/17/17,16:52:00,93,128,125,19,16,0,0,https://pbs.twimg.com/profile_images/833548869275312128/Wf0oXEno_400x400.jpg,https://pbs.twimg.com/profile_banners/832754744326098944/1487568849/1500x500,1396,0,0.9765625,3,0business,833878578,LowestRates.ca,LowestRates_ca,"We save you money by helping you compare insurance, mortgages, credit cards, and more. #JustLikeThat",Canada,http://lowestrates.ca,9/19/12,11:24:00,11577,3858,3868,7237,1629,0,0,https://pbs.twimg.com/profile_images/720728416232714240/gJi_GZl2_400x400.jpg,https://pbs.twimg.com/profile_banners/833878578/1547051693/1500x500,2983,0,1.002592017,1,0business,8.20E+17,AlternativeLending,SBLendingDaily,"The industry leader in providing news, commentary, and analysis for lenders, brokers, and service providers #AlternativeLending",,https://alternativelending.io,1/12/17,11:50:00,1940,2155,875,53,699,0,0,https://pbs.twimg.com/profile_images/910492419950493697/i0h5K-i-_400x400.jpg,https://pbs.twimg.com/profile_banners/819632634187939840/1505913276/1500x500,4850,0,0.406032483,1,0business,8.21E+17,ALP Translations,AlpTranslations,We are an Association of #Language Professionals that provides #translation and #localization services. #xl8 #t9n #smallbiz. Tweets by Co-Founder Mariano Saab.,,http://www.alptranslations.com,1/16/17,17:33:00,454,1137,774,109,21,0,0,https://pbs.twimg.com/profile_images/849653779377074176/Co804Ndk_400x400.jpg,https://pbs.twimg.com/profile_banners/821168524508983297/1485734915/1500x500,11253,0,0.680738786,3,0business,8.25E+17,The Ketogenic Way,KetoWay,"Join us in satisfiying your cravings for the ketogenic lifestyle! We tweet about the latest news and events. Also, check out our online ketogenic grocery store!",,http://ketogenicmeal.com,1/27/17,20:30:00,97,560,350,5,6,0,0,https://pbs.twimg.com/profile_images/825200673109209088/KuiRPHXx_400x400.jpg,https://pbs.twimg.com/profile_banners/825199452650610689/1485578835/1500x500,4702,0,0.625,0,0business,2302072946,C4B Funding,C4BFunding,Get fast and reliable funding for your business with C4B Funding. With 2 hour approvals and funding within 24 hours! Visit,USA,https://c4bfunding.com,1/20/14,13:54:00,842,1312,818,1629,44,0,0,https://pbs.twimg.com/profile_images/917850075295916032/_aV7HFUc_400x400.jpg,https://pbs.twimg.com/profile_banners/2302072946/1507667548/1500x500,5059,0,0.62347561,1,0business,7.00E+17,Lunacap Ventures,lunacapventures,"LunaCap Ventures is an early stage venture debt fund investing in Military, Women and Minority (#MWM) founders.",New York City ,http://www.lunacapventures.com,2/18/16,15:49:00,793,2463,1125,1364,39,0,0,https://pbs.twimg.com/profile_images/838891996848750592/zWQxu8rP_400x400.jpg,https://pbs.twimg.com/profile_banners/700467193683832832/1489380434/1500x500,7233,0,0.456760049,0,1business,4781256158,Beau & Belle Littles,bblittles,"Family owned, family focused. Making beautiful reusable baby products with love. Our core line consists of the Nageuret Swim Diaper, we love it and so will you!",,http://bblittles.com,1/18/16,20:01:00,397,338,342,706,23,0,0,https://pbs.twimg.com/profile_images/750809413212991489/2spwkWkj_400x400.jpg,https://pbs.twimg.com/profile_banners/4781256158/1453177193/1500x500,7821,0,1.01183432,0,0business,2905163500,Teckst,teckstco,We integrate text and mobile messaging into your current CRM: @zendesk @freshdesk @salesforce @oracle @msdynamics,"New York, NY",http://teckst.com,12/4/14,6:31:00,1682,2369,718,1600,360,0,0,https://pbs.twimg.com/profile_images/1042842602163396608/9KZoZg1f_400x400.jpg,https://pbs.twimg.com/profile_banners/2905163500/1537468608/1500x500,1489,0,0.303081469,0,0business,8.03E+17,Social Insight,gosocialinsight,"Social Insight is a lead generation agency. We help company to generate traffic to lead conversion. Try us out, click below link for a FREE TRIAL!",,http://socialinsight.monatbpo.com,11/27/16,21:44:00,2510,4653,1386,18401,156,0,0,https://pbs.twimg.com/profile_images/803118228268400640/s4OSiRxz_400x400.jpg,https://pbs.twimg.com/profile_banners/803112300378865666/1492545065/1500x500,1577,0,0.29787234,2,0business,8.12E+17,Empire Recovery,empirerecover,We are a Debt Recovery Company for Business to Business. Debt Recovery Is Our Specialty. You can see our services at: http://empirerecover.com/___’öÎŒ_—_,,,12/22/16,21:23:00,17,131,40,36,11,0,0,https://pbs.twimg.com/profile_images/812167548544237571/ihwk4klU_400x400.jpg,https://pbs.twimg.com/profile_banners/812166841909084160/1485538809/1500x500,2738,0,0.305343511,1,0business,8.19E+17,WAYNE INDUSTRIES,WAYNEINDUNLTD,Mega Conglomerate Start-Up Company Follow our Founder & CEO @wayneesteen #mobileceo #entrepreneurship #savetheworld #growthhack,"Gotham, New York",,1/11/17,20:30:00,64,572,148,104,2,0,0,https://pbs.twimg.com/profile_images/819405242844540928/0Wg3AU1t_400x400.jpg,https://pbs.twimg.com/profile_banners/819401262911410176/1484196597/1500x500,29563,0,0.258741259,0,2business,7.56E+17,Next-Financing,NextFinancing,"FinTech Platform/Lender - We provide a Full Suite of Direct Capital Solutions, Consumer Financing & Custom Payment/Financing Portals. Building Tomorrow - Today.","Scottsdale, AZ",http://Next-Financing.com,7/20/16,0:07:00,491,3541,3763,571,315,0,0,https://pbs.twimg.com/profile_images/866506433679851520/V2NTWAi0_400x400.jpg,https://pbs.twimg.com/profile_banners/755660265568559104/1546123198/1500x500,3160,0,1.062694154,1,0business,8.18E+17,The Daily Debit,TheDailyDebit,As the alternative lending space continues to grow ever larger the most valuable tool you can have is information. http://TheDailyDebit.com___’öÎŒ_—_,,http://www.thedailydebit.com,1/9/17,8:17:00,9474,230,170,4,3656,0,0,https://pbs.twimg.com/profile_images/826172179364663296/ZKjfhJo2_400x400.jpg,https://pbs.twimg.com/profile_banners/818491881743126531/1485809805/1500x500,2721,0,0.739130435,1,0business,50128726,TechNet,TechNetUpdate,"The national, bipartisan network of innovation economy CEOs & senior execs. IT, e-commerce, sharing/gig economies, advanced energy, cybersecurity, VC & finance",DC SV BOS CHI Austin Olympia,http://www.technet.org,6/23/09,15:46:00,5883,2172,4015,1071,718,0,0,https://pbs.twimg.com/profile_images/847137229260623872/b5UOvnGy_400x400.jpg,https://pbs.twimg.com/profile_banners/50128726/1489439445/1500x500,8080,0,1.848526703,1,0business,112218976,GrowthForce___Î¢_—_’Ü’_ÎŒÎ¢,GrowthForce,"Helping strategic #CEOs, #EDs, & #CPAs make better business decisions with timely, actionable financial intelligence delivered by a dedicated US-based team","Houston, Texas",http://www.growthforce.com,2/7/10,9:36:00,2164,1502,1090,1010,700,0,0,https://pbs.twimg.com/profile_images/474203703759478785/JKwO7ED6_400x400.png,https://pbs.twimg.com/profile_banners/112218976/1482017038/1500x500,4548,0,0.725699068,1,1business,168834351,Zivaro,Zivaro_,Zivaro provides illuminated consulting & technology services that help clients derive real business value from their technology investments.,"Denver, CO",http://www.zivaro.com,7/20/10,15:30:00,9096,4226,2647,319,617,0,0,https://pbs.twimg.com/profile_images/1046818602173652992/7T5wRD_q_400x400.jpg,https://pbs.twimg.com/profile_banners/168834351/1538429998/1500x500,2098,0,0.626360625,3,0business,958417638,Experian Vision,ExperianVision,Official account for the Experian Vision conference #ExperianVision #FinTech #Banking #Lending #IoT #BigData #Analytics ___________è_—_’Ü’_ÎŒ___ Also on Instagram: ExperianVision ___________è_—_’Ü’_ÎŒ__è,,http://spr.ly/6015EHFhB,11/19/12,12:21:00,1111,630,465,494,253,0,0,https://pbs.twimg.com/profile_images/810900323308929024/tKzd99lu_400x400.jpg,https://pbs.twimg.com/profile_banners/958417638/1543350844/1500x500,5152,0,0.738095238,0,0business,589622606,Kazoo,kazoo_HR,We create rewarding and purpose-filled workplaces.,"Austin, TX",http://www.KazooHR.com,5/24/12,19:43:00,9437,1270,2182,1399,3248,0,0,https://pbs.twimg.com/profile_images/1113411478512599045/GlS_coag_400x400.png,https://pbs.twimg.com/profile_banners/589622606/1554312149/1500x500,0,999,1.718110236,0,0business,2789020602,Sons of Sawdust,ofsawdust,A family crafting custom furniture from 100yr old reclaimed wood. We carry on the legacy of our grandfather in every piece we make. Instagram: sonsofsawdust,,http://sonsofsawdust.com,9/3/14,20:19:00,1506,442,1197,1310,830,0,0,https://pbs.twimg.com/profile_images/507368197423521792/Ugqkz_cH_400x400.jpeg,https://pbs.twimg.com/profile_banners/2789020602/1409801085/1500x500,1168,0,2.708144796,0,1business,525713285,Business Rockstars,bizrockstars,"We are the first integrated, multi-platform media company for #entrepreneurs #startups & #founders - We have more cool content on @venturermedia",California,http://BusinessRockstars.com,3/15/12,13:15:00,7442,100993,368325,4368,2962,0,1,https://pbs.twimg.com/profile_images/733442379403792384/jZNSEycG_400x400.jpg,https://pbs.twimg.com/profile_banners/525713285/1473460850/1500x500,2047,0,3.647034943,2,2business,8.06E+17,ClearKred,ClearKred,ClearKred is a private ISO / Brokerage for SMBs seeking access to capital funding and working capital to sustain and grow merchants' businesses.,,https://clearkred.com,12/5/16,3:03:00,1,83,17,0,0,0,0,https://pbs.twimg.com/profile_images/805733532685529088/VVuEmbyY_400x400.jpg,https://pbs.twimg.com/profile_banners/805729373177413632/1480939659/1500x500,5329,0,0.204819277,3,0business,7.07E+17,WILLIAM FRY,WilliamFryLaw,"William Fry is the law firm of choice for corporate Ireland. We have offices in Dublin (HQ), London, New York, San Francisco & Silicon Valley.",,http://www.williamfry.com,3/8/16,6:35:00,1321,1425,1362,805,438,0,0,https://pbs.twimg.com/profile_images/826146845252583424/H4ep4Mmw_400x400.jpg,https://pbs.twimg.com/profile_banners/707213083513638913/1485161818/1500x500,1679,999,0.955789474,0,0business,2191814292,Leading Edge Only,leadingedgeonly,The Global Innovation Marketplace. We bring together thousands of innovations all in one place and actively showcase them to organisations seeking new solutions,"London, UK",http://www.leadingedgeonly.com,11/12/13,23:06:00,3284,1489,918,1447,508,0,0,https://pbs.twimg.com/profile_images/928191640493330433/DSN5oRFt_400x400.jpg,https://pbs.twimg.com/profile_banners/2191814292/1551449852/1500x500,3436,0,0.616521155,1,0business,8.01E+17,A_ImperialFunds,A_ImperialFund,Imperial Business Solutions is a Business Funding Firm that offers a variety of funding options for all business types.,,http://www.imperialfunds.com/,11/22/16,10:59:00,9,175,23,1,0,0,0,https://pbs.twimg.com/profile_images/804364608295215104/wr7nJdnN_400x400.jpg,https://pbs.twimg.com/profile_banners/801138015322173441/1479919020/1500x500,6325,0,0.131428571,1,0business,7.41E+17,CUE,cuemarketplace,"Discover, purchase and manage the best software and services for your business. All in One Place. https://cuemarketplace.com/marketplace___’öÎŒ_—_",,https://cuemarketplace.com/,6/9/16,10:03:00,863,738,503,336,32,0,0,https://pbs.twimg.com/profile_images/1009197229351956480/GNk3AvVi_400x400.jpg,https://pbs.twimg.com/profile_banners/740952496042971137/1529523737/1500x500,3607,0,0.681571816,1,0business,418237641,Crowdfunding360,Crowdfunding360,Cutting-edge commentary on the emerging area of online capital formation and deal sourcing #crowdfunding,"New York, NY",http://crowdfunding360.com,11/21/11,14:47:00,455,920,2768,1,47,0,0,https://pbs.twimg.com/profile_images/796065740205891585/eDs_gTRV_400x400.jpg,,5720,0,3.008695652,2,0business,239463542,InCycle Software,InCycleSoftware,Microsoft @Azure & #DevOps partner. We help customers accelerate the development of modern apps with #Microsoft #Azure & #DevOps.,USA/Canada - Regional Offices,http://www.incyclesoftware.com,1/17/11,9:48:00,2167,3004,1093,831,134,0,0,https://pbs.twimg.com/profile_images/2729280055/e2d574d437e081297536eb6755c261ac_400x400.png,https://pbs.twimg.com/profile_banners/239463542/1429024567/1500x500,1734,0,0.363848202,1,0business,56470157,Decusoft,Decusoft,Delivering configurable software solutions and professional services to help companies streamline complex business functions including compensation & benefits.,"Ramsey, New Jersey",http://www.decusoft.com,7/13/09,12:38:00,3400,1148,442,839,268,0,0,https://pbs.twimg.com/profile_images/643870615607316480/tW4P1O1p_400x400.jpg,https://pbs.twimg.com/profile_banners/56470157/1486239795/1500x500,6094,0,0.385017422,3,0business,7.33E+17,Fintech Lab,FintechLabThu,"Founded by Tsinghua University's PBC school of finance in 2012,we are the first and leading research entity focusing on research and incubation in fintech.","Beijing,China",http://fintechlab.pbcsf.tsinghua.edu.cn/,5/17/16,21:45:00,651,952,426,595,258,0,0,https://pbs.twimg.com/profile_images/1061811102223360000/PNP-tKCy_400x400.jpg,https://pbs.twimg.com/profile_banners/732794126681448450/1463628009/1500x500,7666,0,0.447478992,2,1business,1924806510,HealthSuplrDiversity,_HSDA,Healthcare Supplier Diversity Alliance: Building awareness through education and creating pathways to opportunities for historically underutilized businesses.,,http://www.hsdafordiversity.org/,10/1/13,15:32:00,3386,521,680,17,13,0,0,https://pbs.twimg.com/profile_images/440565165914726400/NNpShNtb_400x400.jpeg,https://pbs.twimg.com/profile_banners/1924806510/1413927229/1500x500,8418,0,1.305182342,1,0business,2249053748,Thrinacia,Thrinacia,"The CrowdFunding Infrastructure. Build, customize and operate CrowdFunding Websites, Widgets and Applications. Integrate with advanced CrowdFunding REST API's.","Vancouver, B.C Canada",http://www.thrinacia.com,12/16/13,9:22:00,7461,1886,711,1860,961,0,0,https://pbs.twimg.com/profile_images/555815606218285056/inqif-jK_400x400.png,https://pbs.twimg.com/profile_banners/2249053748/1460759660/1500x500,33,0,0.376988335,0,0business,2745155864,DataDisrupt,DataDisrupt,"The premier conference for the financial services data analytics ecosystem!  May 22-24 in New York, NY.  Register at http://www.datadisrupt.com___’öÎŒ_—_!",,http://www.datadisrupt.com,8/19/14,7:54:00,281,458,305,253,10,0,0,https://pbs.twimg.com/profile_images/771513944649465856/slBTT5Zt_400x400.jpg,https://pbs.twimg.com/profile_banners/2745155864/1472778552/1500x500,1141,0,0.665938865,2,1business,7.83E+17,Debenture,DebentureFin,We're for entrepreneurs. Thats why we provide quick and easy SME Finance. Borrow from R50 000 - R1 500 000 for your business. Get an approval in 3 days or less.,Stellenbosch | Johannesburg,http://debenture.co.za/,10/2/16,11:31:00,157,425,108,259,8,0,0,https://pbs.twimg.com/profile_images/786224778021597184/mdALJyPB_400x400.jpg,https://pbs.twimg.com/profile_banners/782649328540094465/1475433537/1500x500,8538,0,0.254117647,1,1business,2869414830,Meda,Meda_MN,"We are a nonprofit that helps minority entrepreneurs succeed by providing business consulting, access to capital, and market opportunities.","Minneapolis, MN",http://www.Meda.net,10/21/14,13:51:00,2128,2359,2022,837,418,0,0,https://pbs.twimg.com/profile_images/951829256522248192/mbqIFVIW_400x400.jpg,https://pbs.twimg.com/profile_banners/2869414830/1534424552/1500x500,6452,0,0.857142857,2,1business,7.28E+17,CapitalRise,CapitalRiseLive,"Online platform for prime property lending and investing.  Invest from ___’öÎŒÎ£1,000 and earn 8-12% p.a. Capital at Risk. #primeproperty #investments #propertylending","London, UK.",http://www.capitalrise.com,5/3/16,7:54:00,622,4516,1673,115,198,0,0,https://pbs.twimg.com/profile_images/733657955778826242/OKYWQo8S_400x400.jpg,https://pbs.twimg.com/profile_banners/727511615147487232/1553869048/1500x500,5095,0,0.370460585,2,0business,4789939594,Home_By_Eva,Home_by_Eva,Custom decorating and fabrication for homes in Washington DC area. We believe in the art of sewing and magic of the fabric. Eva Suwak,"Arlington, VA",http://www.homebyeva.com,1/12/16,18:18:00,107,113,48,260,50,0,0,https://pbs.twimg.com/profile_images/1120382337135665157/affwTndZ_400x400.png,https://pbs.twimg.com/profile_banners/4789939594/1473393391/1500x500,9382,0,0.424778761,0,0business,29763980,CRICHCreative,CRICH_Creative,Welcome to CRICH Creative! An #digitalonline company! We offer ___________è_—_’Ü’ŒÎŒ_—¢___’…ÎŒ__èÎŒ’å#webdesign ___________è_—_’Ü’Œ___’____’…ÎŒ__èÎŒ’å #graphicdesign ___________è___’____Ô©#socialmediaservices and #video ___________è_—_’Ü’_ÎŒÔ©___’…ÎŒ__èÎŒ’åconnect@crichcreative.com___________è_—_’Ü’_ÎŒ___,Canada,http://crichcreative.com,4/8/09,10:10:00,917,1574,519,20,51,0,0,https://pbs.twimg.com/profile_images/788514138171568128/BJkNeWE2_400x400.jpg,https://pbs.twimg.com/profile_banners/29763980/1503001600/1500x500,4060,0,0.329733164,2,0business,4729157580,QwkTax,QwkTax,QwkTax helps businesses and freelancers save money on taxes. We aren't paper filers. We bring innovative tax strategy to all the DOers out there!,,http://blog.qwktax.com,1/8/16,8:51:00,424,3543,1284,11567,273,0,0,https://pbs.twimg.com/profile_images/1075481515822202880/30xRZkEY_400x400.jpg,https://pbs.twimg.com/profile_banners/4729157580/1545248229/1500x500,6486,0,0.362404742,2,0business,1875776161,Millennium Trust,mtrustcompany,"We empower our clients with trusted expertise, exceptional service and access to a wide range of custody solutions. Disclaimer: http://www.mtrustcompany.com/social___’öÎŒ_—_","Oak Brook, IL",http://www.mtrustcompany.com,9/17/13,7:39:00,2351,691,1660,453,1066,0,0,https://pbs.twimg.com/profile_images/877207477451767808/-kj1N8Cb_400x400.jpg,https://pbs.twimg.com/profile_banners/1875776161/1492533602/1500x500,3514,0,2.402315485,2,0business,7.58E+17,Global Funding,Gl0balFunding,"Global Funding gives business owners the security and tools needed to grow, in minutes.","Miami, FL",http://www.globalfunding.com/loan-options,7/27/16,19:29:00,112,220,113,33,9,0,0,https://pbs.twimg.com/profile_images/1090547944166694912/TAoA_Hzj_400x400.jpg,https://pbs.twimg.com/profile_banners/758489532119388160/1482436571/1500x500,4165,0,0.513636364,0,0business,3148046523,PrestaCap,PrestaCap,PrestaCap is an innovative financing platform for small and medium businesses in Europe. #FinTech #Firmenkredite #Crowdlending #KMU #Lending,London,http://prestacap.com/en/,4/8/15,7:29:00,158,452,176,77,16,0,0,https://pbs.twimg.com/profile_images/859446603421286403/_3kORoAz_400x400.jpg,https://pbs.twimg.com/profile_banners/3148046523/1493753231/1500x500,3802,0,0.389380531,4,0business,2360636064,Reinventure,ReinventureFund,Pioneering founder-first corporate venture capital,,http://www.reinventure.com.au,2/24/14,22:44:00,941,1263,2573,2293,55,0,0,https://pbs.twimg.com/profile_images/938336794193432576/dYL_ll3S_400x400.jpg,https://pbs.twimg.com/profile_banners/2360636064/1497920323/1500x500,11013,0,2.037212985,1,1